,Type,Studio,Tags,Rating,Release_year
1876,TV   ,A-1 Pictures,"Comedy, Sci Fi, Sports, Aliens, Coming of Age, Countryside, Fishing, Island, Iyashikei, Mental Illness, noitaminA, Ocean, Original Work",3.81,2012.0
1877,Movie,POLYGON PICTURES,"Horror, Seinen, Human Experimentation, Supernatural, Based on a Manga, CG Animation, Mature Themes,, Suicide",3.81,2016.0
1879,TV   ,Studio DEEN,"Romance, Demons, Historical, Japanese Mythology, Supernatural, Based on a Light Novel",3.81,2006.0
1880,TV   ,Toei Animation,"Action, Sci Fi, Shounen, Monsters, Based on a Manga",3.81,2014.0
1881,TV   ,Dongwoo A&E,"Idols, Music, Showbiz, Based on a Video Game",3.81,2016.0
1883,Movie,Toei Animation,"Action, Drama, Sci Fi, Seinen, Aliens, Leijiverse, Outer Space, Space Opera, Space Pirates, Based on a Manga, CG Animation",3.81,2013.0
1885,TV   ,TMS Entertainment,"Action, Adventure, Drama, Fantasy, Romance, Isekai, Magic, Orphans, Person in a Strange World, Reincarnation, Based on a Light Novel",3.81,2021.0
1886,Movie,Toei Animation,"Magical Girl, Shoujo, Henshin Heroes, Magic, Sentai, Tokusatsu, Based on a Manga",3.81,1993.0
1887,Movie,Toei Animation,"Action, Adventure, Shounen, Island, Pirates, Superpowers, Based on a Manga",3.81,2006.0
1888,TV   ,XEBEC,"Action, Adventure, Comedy, Shounen, Tournaments, Based on a Manga",3.81,2001.0
1892,Movie,GONZO,"Action, Adventure, Revenge, Samurai, Based on a Doujinshi, Drug Use,, Explicit Violence,, Mature Themes,, Sexual Content",3.81,2007.0
1893,TV   ,CONNECT,"Comedy, Drama, Romance, Shounen, Breaking the Fourth Wall, Love Triangle, Romantic Comedy, School Life, Based on a Light Novel",3.81,2019.0
1894,TV   ,Lay-duce,"Comedy, Drama, Romance, Shounen, Coming of Age, School Club, School Life, Based on a Manga",3.81,2019.0
1895,Movie,MADHOUSE,"Fantasy, Magical Girl, Shoujo, Family Friendly, Henshin Heroes, Magic, Based on a Manga",3.81,1999.0
1896,TV   ,Shuka,"Drama, Mystery, Based on a Light Novel",3.8,2020.0
1897,TV   ,J.C.Staff,"Drama, Fantasy, Boarding School, Conspiracy, Contemporary Fantasy, Deal with the Devil, LGBT Themes, Mind Games, Orphans, Psychological, School Life, Student Council, Swordplay, Original Work, Animal Abuse,, Bullying,, Mature Themes,, Physical Abuse",3.8,1997.0
1898,TV   ,GONZO,"Action, Adventure, Mecha, Sci Fi, Samurai, Steampunk, Swordplay, Based on a Movie, Violence",3.8,2004.0
1900,TV   ,Studio DEEN,"Seinen, Sports, Soccer, Tournaments, Based on a Manga",3.8,2010.0
1901,TV   ,AIC Build,"Comedy, Ecchi, Harem, Otaku Culture, School Club, School Life, Based on a Light Novel, Nudity",3.8,2011.0
1902,TV   ,Shirogumi,"Comedy, Seinen, Agriculture, Anthropomorphic, College, Educational, noitaminA, School Life, Based on a Manga",3.8,2007.0
1904,Movie,SANZIGEN,"All-Girls School, Music, School Life, CG Animation, Original Work",3.8,2019.0
1905,TV   ,LIDEN FILMS,"Romance, Shounen, Animeism, Boarding School, School Life, Star-Crossed Lovers, Based on a Manga",3.8,2018.0
1907,TV   ,J.C.Staff,"Drama, Romance, Shounen, Aliens, Countryside, Non-Human Protagonists, Photography, School Life, Original Work",3.8,2012.0
1910,Movie,Studio 4°C,"Fantasy, Abstract, Based on a Manga",3.8,2004.0
1912,Movie,Magic Bus,"Drama, Slice of Life, Disability, School Life, Siblings, Bullying",3.8,2003.0
1916,TV   ,ENGI,"Comedy, Ecchi, Romance, Shounen, Slice of Life, College, Senpai-Kouhai Relationship, Based on a Manga",3.8,2020.0
1917,TV   ,Toei Animation,"Comedy, Abstract, Educational, Medical, noitaminA, Psychological, Drug Use,, Mature Themes",3.8,2009.0
1918,Movie,Toei Animation,"Action, Comedy, Drama, Shounen, Sports, Basketball, Delinquents, School Club, School Life, Based on a Manga, Mature Themes,, Physical Abuse",3.8,1994.0
1920,TV   ,OLM,"Drama, Sports, Family Friendly, Soccer, Superpowers, Tournaments, Based on a Video Game",3.8,2008.0
1921,TV   ,Pierrot,"Drama, Romance, Seinen, 19th Century, Adult Couples, England, Europe, Historical, Maids, Mature Romance, Social Gap, Work Life, Based on a Manga",3.8,2005.0
1922,TV   ,Pierrot,"Comedy, Josei, Slice of Life, Breaking the Fourth Wall, Episodic, Gag, NEET, Parody, Siblings, Slapstick, Based on a Manga",3.8,2020.0
1923,Movie,Digital Frontier,"Action, Sci Fi, Seinen, Aliens, Guns, Psychological, Based on a Manga, CG Animation, Explicit Violence,, Nudity",3.8,2016.0
1924,TV   ,MADHOUSE,"Drama, Fantasy, Horror, Collections, Historical, Loneliness, Love Triangle, Psychological, Thriller, Based on a Novel, Mature Themes,, Sexual Abuse,, Sexual Content,, Suicide,, Violence",3.8,2009.0
1926,TV   ,Sunrise,"All-Girls School, Idols, Music, School Club, School Life",3.8,2020.0
1931,TV   ,J.C.Staff,"Comedy, Romance, Seinen, Animal Characteristics, Japanese Mythology, Military, Non-Human Protagonists, Supernatural, Youkai, Based on a Manga",3.8,2010.0
1932,TV   ,Manglobe,"Action, Sci Fi, Shounen, Conspiracy, Framed for a Crime, High Stakes Games, Play or Die, Prison, PVP, Superpowers, Weak to Strong, Based on a Manga, Explicit Violence,, Nudity",3.8,2011.0
1933,Movie,Mili Pictures,"Action, Adventure, Fantasy, Chinese Animation, Elves, Non-Human Protagonists, Based on a Video Game",3.8,2016.0
1934,TV   ,diomedea,"Comedy, Seinen, Slice of Life, Gag, Panty Shots, Based on a Manga",3.8,2018.0
1937,Movie,TYO Animations,"Slice of Life, Iyashikei, Photography, Original Work",3.8,2015.0
1938,TV   ,TRIGGER,"Drama, Sci Fi, Human Experimentation, Psychological, Original Work",3.8,2016.0
1939,Movie,WIT Studio,"Outer Space, Based on a Manga, CG Animation",3.8,2017.0
1940,TV   ,Sunrise,"All-Girls School, Idols, Music, School Club, School Life",3.8,2013.0
1943,TV   ,J.C.Staff,"Comedy, Fantasy, Magical Girl, Seinen, Slice of Life, Contemporary Fantasy, Demons, Henshin Heroes, School Life, Urban Fantasy, Based on a 4-Koma Manga, Based on a Manga",3.8,2019.0
1944,TV   ,Seven Arcs,"Action, Comedy, Ecchi, Fantasy, Harem, Shounen, Boarding School, Magic, Magic School, School Life, Based on a Manga",3.8,2014.0
1945,Movie,Pierrot,"Action, Shounen, Ninja, Based on a Manga",3.8,2007.0
1946,TV   ,CygamesPictures,"Action, Adventure, Comedy, Fantasy, Amnesia, Guilds, Magic, Monsters, Based on a Mobile Game",3.8,2022.0
1948,Movie,Kyoto Animation,"Drama, Music, Recap, School Club, School Life, Based on a Novel",3.8,2017.0
1950,Movie,Nippon Animation,"Drama, Shoujo, Art, Music",3.8,1992.0
1951,Movie,GoHands,"Action, Gangs, Supernatural, Superpowers, Original Work",3.8,2018.0
1952,TV   ,NUT,"Action, Sci Fi, Isolated Society, Monsters, Post-apocalyptic, Original Work, Violence",3.8,2020.0
1953,TV   ,MAPPA,"Comedy, Drama, Shounen, Sports, School Life, Soccer, Tournaments, Based on a Manga",3.8,2016.0
1955,TV   ,SILVER LINK.,"Action, Comedy, Fantasy, Magical Girl, Shounen, Contemporary Fantasy, Henshin Heroes, Magic, Urban Fantasy, Based on a Manga, Sexual Content",3.8,2016.0
1957,TV   ,MADHOUSE,"Adventure, Seinen, Detectives, Episodic, Espionage, Europe, Work Life, Based on a Manga",3.8,1998.0
1958,Movie,GoHands,"Action, Drama, Police, Supernatural, Superpowers, Original Work",3.8,2018.0
1961,TV   ,Sunrise,"Action, Ecchi, Sci Fi, War, Based on a Light Novel",3.8,2012.0
1962,TV   ,AIC,"Adventure, Comedy, Fantasy, Harem, Sci Fi, Aliens, Non-Human Protagonists, Outer Space, Space Pirates",3.8,1995.0
1963,TV   ,Toei Animation,"Fantasy, Magical Girl, Sci Fi, Aliens, Henshin Heroes, Magic, Sentai, Superheroes, Tokusatsu",3.8,2019.0
1967,Movie,Bones,"Sci Fi, Supernatural, Superpowers, Original Work",3.8,2011.0
1968,TV   ,Seven Arcs,"Drama, Romance, Seinen, 16th Century, Apprenticeship, Art, Europe, Historical, Italy, Nobility, Based on a Manga",3.79,2020.0
1969,TV   ,Brain's Base,"Comedy, Reverse Harem, Romance, Shoujo, Fujoshi, Lifestyle Change, Otaku Culture, School Life, Based on a Manga",3.79,2016.0
1970,TV   ,TROYCA,"Action, Fantasy, Sci Fi, Contemporary Fantasy, Person in a Strange World, Reverse Isekai, Urban Fantasy, Original Work, Violence",3.79,2017.0
1972,Movie,Light Chaser Animation,"Action, Adventure, Fantasy, Ancient China, Chinese Animation, Martial Arts",3.79,2021.0
1974,TV   ,AIC Spirits,"Action, Horror, Shounen, Demons, Supernatural, Based on a Manga, Explicit Violence,, Nudity",3.79,2008.0
1977,Movie,production doA,"Comedy, Seinen, Slice of Life, Cafe, Iyashikei, Based on a 4-Koma Manga, Based on a Manga",3.79,2017.0
1979,TV   ,Sunrise,"Action, Mecha, Sci Fi, Proxy Battles, Tournaments",3.79,2014.0
1981,TV   ,Studio DEEN,"Action, Comedy, Drama, Seinen, Coworkers, Police, Work Life, Based on a Manga",3.79,2001.0
1983,TV   ,XEBEC,"Action, Adventure, Mecha, Sci Fi, Aliens, Military, Outer Space, Post-apocalyptic, Prophecy, Space Opera, Original Work",3.79,2007.0
1984,Movie,TMS Entertainment,"Action, Shounen, Desert, Dystopia, Hand to Hand Combat, Martial Arts, Overpowered Main Characters, Post-apocalyptic, Based on a Manga, Explicit Violence,, Mature Themes,, Physical Abuse",3.79,2007.0
1985,Movie,Bones,"Sci Fi, Supernatural, Superpowers, Original Work",3.79,2011.0
1986,Movie,Toei Animation,"Action, Shounen, Aliens, Hand to Hand Combat, Martial Arts, Non-Human Protagonists, Superpowers, Based on a Manga",3.79,1993.0
1987,Movie,AIC,"Fantasy, Romance, Seinen, Contemporary Fantasy, God-Human Relationship, Gods, Interspecies Relationship, Magic, Non-Human Protagonists, Based on a Manga",3.79,2000.0
1988,TV   ,Actas,"Action, Military, Military School, School Club, School Life, Tournaments, Original Work",3.79,2012.0
1991,TV   ,Sunrise,"Action, Fantasy, Demons, Feudal Japan, Supernatural",3.79,2021.0
1992,TV   ,MAPPA,"Comedy, Drama, Idols, Music, Showbiz, Supernatural, Zombies, Original Work",3.79,2018.0
1993,Movie,Pierrot,"Action, Shounen, Ninja, Based on a Manga",3.79,2008.0
1995,TV   ,Maho Film,"Fantasy, Cheats, Reincarnation, RPG, Virtual Reality, Based on a Light Novel",3.79,2022.0
1997,Movie,Production I.G,"Shounen, Sports, Tennis, Based on a Manga",3.79,2005.0
1998,TV   ,Studio DEEN,"Action, Drama, Feudal Japan, Historical, Samurai, Based on an Otome Game, Based on a Visual Novel",3.79,2012.0
2000,TV   ,MADHOUSE,"Seinen, Androphobia, Forest, High Stakes Games, Island, Jungle, NEET, Play or Die, PVP, Survival, Based on a Manga, Explicit Violence,, Mature Themes,, Physical Abuse,, Sexual Abuse,, Sexual Content,, Suicide",3.79,2012.0
2001,Movie,OLM,"Sports, Island, Soccer, Based on a Video Game",3.79,2011.0
2003,Movie,Studio DEEN,"Action, Adventure, Fantasy, Shounen, Demons, Magic, Medieval, Non-Human Protagonists, Overpowered Main Characters, Superpowers, Based on a Manga, Violence",3.79,2021.0
2007,TV   ,Sunrise,"Action, Drama, Mecha, Sci Fi, Animeism, Outer Space, War, Original Work",3.79,2013.0
2010,TV   ,Brain's Base,"Action, Comedy, Drama, Shounen, Crossdressing, Guns, Tournaments, Based on a Manga",3.79,2015.0
2011,TV   ,Sunrise,"Fantasy, Seinen, Alcohol, Bar, Contemporary Fantasy, Episodic, Food and Beverage, Isekai, Iyashikei, Person in a Strange World, Restaurants, Reverse Isekai, Based on a Light Novel",3.79,2018.0
2012,TV   ,Production I.G,"Action, Mystery, Master-Servant Relationship, Supernatural, Swordplay, Vampires, Violence",3.79,2005.0
2014,TV   ,AIC ASTA,"Comedy, Seinen, Gag, Monsters, Parody, Superheroes, Based on a Manga",3.79,2008.0
2015,TV   ,Mushi Production,"Shounen, Sports, Boxing, Hand to Hand Combat, Based on a Manga",3.79,1970.0
2016,TV   ,Yumeta Company,"Classical Music, Music, Music School, School Life, Based on an Otome Game, Based on a Visual Novel",3.79,2006.0
2017,Movie,Platinum Vision,"Action, Josei, Master-Servant Relationship, Supernatural, Vampires, Based on a Manga",3.79,2018.0
2020,TV   ,Lerche,"Fantasy, Slice of Life, Animal Characteristics, Coworkers, Hotels and Inns, Iyashikei, Japanese Mythology, Non-Human Protagonists, Supernatural, Based on a Manga",3.79,2017.0
2021,TV   ,Toei Animation,"Action, Magical Girl, Family Friendly, Henshin Heroes, Magic, Monster-of-the-week, Sentai, Superheroes, Tokusatsu",3.79,2015.0
2022,Movie,Toei Animation,"Magical Girl, Europe, Henshin Heroes, Magic, Supernatural",3.79,2010.0
2024,TV   ,Toei Animation,"Mystery, Shounen, Based on a Manga",3.79,2015.0
2025,TV   ,Tatsunoko Production,"Ice Skating, Idols, Music, Showbiz, Based on a Video Game",3.79,2013.0
2028,TV   ,LIDEN FILMS,"Action, Comedy, Fantasy, Magic, Magic School, School Life, Teaching, Urban Fantasy, Based on a Light Novel, Violence",3.79,2017.0
2029,TV   ,AIC Classic,"Drama, Romance, Seinen, Slice of Life, Childhood Friends, Coming of Age, LGBT Themes, noitaminA, School Life, Based on a Manga",3.78,2011.0
2030,Movie,Production I.G,"Sci Fi, Cyberpunk, Dystopia, Noir, Police, Original Work, Explicit Violence",3.78,2019.0
2031,Movie,Toei Animation,"Action, Drama, Sci Fi, Monsters",3.78,2018.0
2033,Movie,BN Pictures,"Idols, Island, Music, Showbiz, Based on a Card Game",3.78,2016.0
2034,TV   ,Studio DEEN,"Comedy, Drama, Romance, Shounen, Supernatural, Zombies, Based on a Manga, Emotional Abuse,, Mature Themes,, Nudity,, Physical Abuse,, Violence",3.78,2012.0
2035,TV   ,AIC,"Romance, School Life, Based on a Visual Novel",3.78,2012.0
2037,Movie,Toei Animation,"Magical Girl, Shoujo, Cats, Henshin Heroes, Magic, Sentai, Tokusatsu, Based on a Manga",3.78,1994.0
2038,TV   ,Sunrise,"Action, Sci Fi, PVP, Virtual Reality, Based on a Light Novel, Bullying",3.78,2012.0
2040,TV   ,MADHOUSE,"Comedy, Josei, All-Boys School, Delinquents, Gangs, Lifestyle Change, School Life, Teaching, Yakuza, Based on a Manga",3.78,2004.0
2041,TV   ,BEE TRAIN,"Drama, Mystery, Shoujo, Detectives, Ghost Hunters, Ghosts, Supernatural, Based on a Light Novel",3.78,2010.0
2042,TV   ,J.C.Staff,"Comedy, Fantasy, Shounen, Slice of Life, Apprenticeship, Contemporary Fantasy, Countryside, Family Friendly, Family Life, Iyashikei, Lifestyle Change, Magic, Supernatural, Witches, Based on a Manga",3.78,2016.0
2043,TV   ,TROYCA,"Drama, Mystery, Detectives, Based on a Light Novel",3.78,2015.0
2044,Movie,Toei Animation,"Action, Adventure, Comedy, Fantasy, Shounen, Middle Eastern, Pirates, Rebellions, Superpowers, War, Based on a Manga, Violence",3.78,2007.0
2045,TV   ,8-Bit,"Adventure, Seinen, Slice of Life, Iyashikei, Mountain Climbing, The Great Outdoors, Based on a Manga",3.78,2018.0
2046,TV   ,Pierrot,"Adventure, Comedy, Fantasy, Josei, Exorcists, Journey to the West, Based on a Manga",3.78,2004.0
2049,TV   ,A-1 Pictures,"Action, Adventure, Fantasy, Sci Fi, Guns, High Stakes Games, MMORPG, Overpowered Main Characters, Person in a Strange World, PVE, PVP, Virtual Reality, Based on a Light Novel",3.78,2014.0
2050,TV   ,MAPPA,"Drama, Sports, Amnesia, School Club, School Life, Original Work",3.78,2021.0
2051,TV   ,SATELIGHT,"Comedy, Fantasy, Magical Girl, Romance, Shoujo, Family Friendly, Henshin Heroes, Magic, Monster-of-the-week, Based on a Manga",3.78,2007.0
2055,Movie,A-1 Pictures,"Comedy, Drama, Romance, Shoujo, School Life, Based on a Manga",3.78,2020.0
2056,TV   ,A-1 Pictures,"Action, Harem, Romance, Sci Fi, Tournaments, Based on a Light Novel, Violence",3.78,2016.0
2057,Movie,Studio DEEN,"Action, Comedy, Shounen, Martial Arts, Based on a Manga",3.78,1994.0
2058,Movie,ufotable,"Fantasy, Curse, Magic, Person in a Strange World, Urban Fantasy, Witches, Based on a Manga",3.78,2013.0
2059,Movie,Doga Kobo,"Fantasy, Slice of Life, Anthropomorphic, Historical, Recap, Swordplay, Based on a Video Game",3.78,2017.0
2060,Movie,Studio Ghibli,"Adventure, Fantasy, Animal Protagonists, Cats, Contemporary Fantasy, Countryside, Family Friendly, Ghibli Museum Shorts, Non-Human Protagonists, Shorts",3.78,2001.0
2062,TV   ,Pierrot,"Adventure, Fantasy, Reverse Harem, Romance, Shoujo, Betrayal, Isekai, Love Triangle, Magic, Person in a Strange World, Prophecy, Summoned Into Another World, Based on a Manga",3.78,1995.0
2063,TV   ,Sunrise,"Action, Fantasy, Mecha, Romance, Shoujo, Isekai, Love Triangle, Person in a Strange World, Original Work",3.78,1996.0
2064,Movie,TMS Entertainment,"Action, Shounen, Desert, Dystopia, Hand to Hand Combat, Martial Arts, Overpowered Main Characters, Post-apocalyptic, Based on a Manga, Animal Abuse,, Explicit Violence,, Mature Themes,, Physical Abuse",3.78,2008.0
2065,TV   ,A-1 Pictures,"Comedy, Shounen, 19th Century, Butlers, Demons, England, Europe, Master-Servant Relationship, Nobility, Non-Human Protagonists, Supernatural, Based on a Manga",3.78,2010.0
2066,Movie,Graphinica,"Action, Mecha, Sci Fi, Hacking, Non-Human Protagonists, Post-apocalyptic, Robots, Virtual Reality, CG Animation, Nudity",3.78,2014.0
2067,Movie,Visual Works,"Action, Fantasy, Based on a Video Game, CG Animation",3.78,2005.0
2068,TV   ,MADHOUSE,"Mystery, Shounen, Crime, Dark Comedy, Demons, Detectives, Episodic, Psychopaths, Serial Killers, Slapstick, Supernatural, Based on a Manga, Explicit Violence",3.78,2007.0
2069,TV   ,Sunrise,"Mecha, Sci Fi, Real Robot, Rivalries, Original Work",3.78,2004.0
2071,TV   ,Sunrise,"Action, Comedy, Drama, Shounen, Episodic, Guns, Based on a Manga, Nudity",3.78,1987.0
2072,TV   ,AIC Classic,"Comedy, Drama, Romance, Psychic Powers, School Club, School Life, Superpowers, Based on a 4-Koma Manga, Based on a Manga, Bullying",3.78,2013.0
2074,Movie,MADHOUSE,"Action, Feudal Japan, Ninja, Swordplay, Original Work, Explicit Violence,, Nudity,, Sexual Content",3.78,1993.0
2076,TV   ,Gaina,"Drama, Classical Music, Music, School Life, Based on a Manga",3.78,2018.0
2077,Movie,Sanrio,"Drama, Slice of Life, 19th Century, Historical, Based on a TV Series",3.78,1984.0
2083,Movie,Production I.G,"Action, Fantasy, Sci Fi, Magic, Proxy Battles, Superpowers, Based on a Mobile Game",3.78,2021.0
2084,TV   ,diomedea,"Comedy, Shounen, Slice of Life, Iyashikei, Non-Human Protagonists, Ocean, Based on a Manga",3.78,2010.0
2086,Movie,8 Pan,"Shounen, Sports, Cycling, Racing, Recap, School Club, School Life, Based on a Manga",3.78,2017.0
2088,Movie,AIC,"Action, Comedy, Drama, Harem, Sci Fi, Original Work",3.78,1996.0
2093,TV   ,Studio Gokumi,"Comedy, Seinen, Slice of Life, Iyashikei, School Life, Based on a 4-Koma Manga, Based on a Manga",3.78,2015.0
2094,Movie,Production I.G,"Action, Sci Fi, Cyberpunk, Cyborgs, Based on a Manga",3.78,2015.0
2099,TV   ,Bridge,"Drama, Horror, Shounen, Island, Psychological, School Life, Supernatural, Superpowers, Thriller, Based on a Manga, Violence",3.78,2020.0
2100,TV   ,MADHOUSE,"Action, Adventure, Sci Fi, Family Friendly, Monsters, Robots, Survival, Original Work",3.78,2003.0
2102,TV   ,Kyoto Animation,"Comedy, Shounen, Breaking the Fourth Wall, School Club, School Life, Based on a Light Novel",3.78,2009.0
2107,Movie,GoHands,"Sci Fi, Cyberpunk, Gambling, Based on a Novel, Explicit Violence,, Nudity",3.78,2011.0
2110,TV   ,J.C.Staff,"Action, Sci Fi, Psychic Powers, Supernatural, Based on a Manga, Violence",3.78,2019.0
2112,Movie,Toei Animation,"Fantasy, Magic, Witches, Original Work",3.78,2020.0
2114,Movie,Toei Animation,"Adventure, Sci Fi, Leijiverse, Trains, Based on a Manga",3.78,1979.0
2115,TV   ,J.C.Staff,"Adventure, Comedy, Fantasy, Magic, Medieval, Based on a Light Novel",3.77,2008.0
2116,TV   ,Production I.G,"Comedy, Shounen, All-Boys School, Breaking the Fourth Wall, Delinquents, Gag, Parody, Satire, School Life, Short Episodes, Based on a Manga",3.77,2003.0
2117,Movie,Studio DEEN,"Comedy, Ecchi, Harem, Shounen, Gender Bender, Island, Martial Arts, Based on a Manga",3.77,1992.0
2118,TV   ,Sunrise,"Comedy, Shounen, Sports, Gymnastics, School Club, School Life, Tournaments, Based on a Manga",3.77,1996.0
2120,Movie,Production I.G,"Family Friendly, Historical, Magic, Based on a Novel",3.77,1990.0
2121,Movie,BYMENT,"Action, Adventure, Fantasy, Chinese Animation, CG Animation",3.77,2020.0
2122,TV   ,J.C.Staff,"Action, Sci Fi, Superpowers, Based on a Light Novel, Nudity",3.77,2003.0
2124,TV   ,MADHOUSE,"Drama, Romance, Sci Fi, Androids, Interspecies Relationship, Non-Human Protagonists, Robots, Sudden Girlfriend Appearance, Based on a Manga",3.77,2002.0
2126,TV   ,Lerche,"Fantasy, Seinen, Slice of Life, Forest, Iyashikei, Roommates, Based on a Manga",3.77,2018.0
2127,TV   ,TMS Entertainment,"Comedy, Collections, Based on a Manga",3.77,2004.0
2129,TV   ,Pierrot,"Adventure, 16th Century, Family Friendly, Historical, Original Work",3.77,1982.0
2131,TV   ,SANZIGEN,"All-Girls School, Music, School Life, CG Animation, Original Work",3.77,2019.0
2132,TV   ,Studio DEEN,"Action, Drama, Reverse Harem, Feudal Japan, Historical, Samurai, Based on an Otome Game, Based on a Visual Novel",3.77,2010.0
2135,Movie,Sunrise,"Mecha, Sci Fi, Military, Outer Space, Political, Real Robot, Rivalries, War",3.77,1982.0
2136,TV   ,Studio DEEN,"Action, Comedy, Shounen, Superpowers, Tournaments, Based on a Manga",3.77,2005.0
2137,TV   ,Toei Animation,"Comedy, Drama, Reverse Harem, Romance, Shoujo, School Life, Based on a Manga",3.77,1996.0
2139,TV   ,Doga Kobo,"Comedy, Shounen, Angels, Demons, Gag, Lifestyle Change, Non-Human Protagonists, School Life, Supernatural, Based on a Manga",3.77,2017.0
2140,TV   ,CONNECT,"Comedy, Romance, Shounen, Slice of Life, Animeism, Romantic Comedy, School Club, School Life, Short Episodes, Based on a 4-Koma Manga, Based on a Manga",3.77,2019.0
2141,TV   ,Lerche,"Mystery, Animeism, Battle Royale, High Stakes Games, Play or Die, Psychological, PVP, Based on a Video Game, Violence",3.77,2013.0
2142,TV   ,Studio DEEN,"Comedy, Fantasy, Harem, Contemporary Fantasy, Demon King, Isekai, Lifestyle Change, Medieval, Non-Human Protagonists, Person in a Strange World, Royalty, Summoned Into Another World, Based on a Light Novel",3.77,2004.0
2143,TV   ,Dax Production,"Comedy, Seinen, Slice of Life, Animal Protagonists, Cats, Chibi, Countryside, Family Friendly, Gag, Iyashikei, Non-Human Protagonists, Pets, Short Episodes, Based on a 4-Koma Manga, Based on a Manga",3.77,2012.0
2144,Movie,J.C.Staff,"Action, Comedy, Fantasy, Based on a Light Novel",3.77,1998.0
2148,TV   ,asread,"Comedy, Seinen, Slice of Life, Gag, Siblings, Based on a Manga",3.77,2008.0
2152,TV   ,Toei Animation,"Action, Fantasy, Sci Fi, Shounen, Gods, Greek Mythology, Hand to Hand Combat, Non-Human Protagonists, Norse Mythology, Power Suits, Superpowers, Based on a Manga, Mature Themes,, Physical Abuse,, Violence",3.77,1986.0
2153,Movie,Toei Animation,"Action, Drama, Sci Fi, Monsters",3.77,2017.0
2156,TV   ,J.C.Staff,"Comedy, Ecchi, Crude, Dystopia, Parody, Satire, School Life, Terrorism, Based on a Light Novel, Nudity,, Sexual Content",3.77,2015.0
2157,Movie,J.C.Staff,"Adventure, Comedy, Fantasy, Magic, Based on a Light Novel",3.77,1996.0
2160,Movie,Ajia-do,"Action, Adventure, Comedy, Shounen, Family Friendly, Ninja, Based on a Manga",3.77,1996.0
2164,TV   ,Orange,"Sci Fi, Seinen, Overpowered Main Characters, Based on a Manga",3.77,2016.0
2165,Movie,Tatsunoko Production,"Idols, Music",3.77,2016.0
2166,Movie,WIT Studio,"Anime Tamago, Non-Human Protagonists, Robots, Shorts",3.77,2019.0
2168,Movie,TMS Entertainment,"Action, Comedy, Criminals, Thieves, Based on a Manga",3.77,1995.0
2170,TV   ,OLM,"Sports, Family Friendly, Soccer, Based on a Video Game",3.77,2018.0
2173,TV   ,Trans Arts,"Adventure, Comedy, Fantasy, Magic, Medieval, Based on a Light Novel",3.77,1999.0
2174,TV   ,J.C.Staff,"Action, Adventure, Fantasy, Sci Fi, Shounen, Aliens, Guilds, Martial Arts, Outer Space, Robots, Superpowers, Based on a Manga, Bullying,, Emotional Abuse,, Physical Abuse,, Violence",3.77,2021.0
2175,TV   ,A-1 Pictures,"Comedy, Harem, Romance, Doujinshi Industry, noitaminA, Otaku Culture, Video Game Industry, Based on a Light Novel",3.77,2015.0
2176,Movie,Toei Animation,"Action, Comedy, Drama, Shounen, Sports, Basketball, Delinquents, School Club, School Life, Based on a Manga, Mature Themes,, Physical Abuse",3.77,1994.0
2178,TV   ,A-1 Pictures,"Action, Sci Fi, Seinen, Aliens, Body Sharing, Non-Human Protagonists, Police, Based on a Manga",3.77,2008.0
2181,TV   ,Toei Animation,"Comedy, Fantasy, Magical Girl, Romance, Shoujo, Amnesia, Contemporary Fantasy, Elemental Powers, Family Friendly, Henshin Heroes, Magic, Monster-of-the-week, Sentai, Tokusatsu, Urban Fantasy, Based on a Manga",3.77,1993.0
2183,Movie,Toei Animation,"Action, Drama, Sci Fi, Seinen, Aliens, Leijiverse, Space Opera, Space Pirates, War, Based on a Manga, Nudity,, Violence",3.77,1982.0
2185,TV   ,ARMS,"Fantasy, Romance, Demon King, Demons, Economics, Interspecies Relationship, Medieval, Non-Human Protagonists, Based on a Light Novel",3.77,2013.0
2186,TV   ,OLM,"Action, Sci Fi, Japanese Mythology, School Life, Superheroes, Supernatural, Youkai",3.77,2019.0
2190,TV   ,Bridge,"Comedy, Shounen, Slice of Life, School Life, Siblings, Based on a Manga",3.77,2010.0
2192,Movie,Sunrise,"Action, Comedy, Sci Fi, Death of a Loved One, Superheroes, Superpowers, Original Work",3.77,2012.0
2196,Movie,Studio Dadashow,"Drama, Korean Animation",3.76,2014.0
2198,TV   ,OLM,"Sports, Family Friendly, Soccer, Superpowers, Time Travel, Based on a Video Game",3.76,2012.0
2200,Movie,Toei Animation,"Magical Girl, Shoujo, Henshin Heroes, Magic, Sentai, Tokusatsu, Based on a Manga",3.76,1995.0
2203,TV   ,Studio 3Hz,"Adventure, Magical Girl, Sci Fi, Henshin Heroes, Magic, Original Work",3.76,2016.0
2205,Movie,WIT Studio,"Drama, Romance, Sci Fi, Slice of Life, Androids, Coming of Age, Death of a Loved One, Melancholy, Non-Human Protagonists, Robots, Original Work",3.76,2013.0
2206,Movie,J.C.Staff,"Adventure, Comedy, Fantasy, Magic, Based on a Light Novel",3.76,1997.0
2207,TV   ,XEBEC,"Adventure, Mecha, Sci Fi, Sports, Tournaments",3.76,2001.0
2208,TV   ,Dongwoo A&E,"Idols, Music, Showbiz, Based on a Video Game",3.76,2015.0
2209,Movie,WIT Studio,"Action, Shoujo, Historical, Based on a Manga",3.76,2018.0
2210,TV   ,feel.,"Slice of Life, Childcare, Death of a Loved One, Lifestyle Change, Single Parent, Based on a Light Novel",3.76,2012.0
2211,TV   ,Nippon Animation,"Comedy, Shoujo, Slice of Life, Family Friendly, School Life, Based on a Manga",3.76,1990.0
