,Type,Studio,Tags,Rating,Release_year
8893,Movie,OLM,"Adventure, Fantasy, Shounen, Elemental Powers, Family Friendly, Monsters, Based on a Video Game",3.29,2013.0
8894,TV   ,Group TAC,"Animal Protagonists, Dogs, Family Friendly, Non-Human Protagonists, Short Episodes",3.29,2006.0
8906,Movie,TAKUNBOX,"Comedy, Family Friendly, Shorts, Original Work",3.29,2008.0
8911,TV   ,Trans Arts,"Adventure, Fantasy, Medieval, Political, Original Work",3.29,2007.0
8914,Movie,Bones,"Sci Fi, Original Work",3.29,2017.0
8918,TV   ,Sunrise,"Action, Sci Fi, Superpowers, Original Work",3.29,2011.0
8923,TV   ,Japan Vistec,"Action, Adventure, Sci Fi, Shounen, Cyborgs, Superheroes, Based on a Manga",3.29,2001.0
8924,TV   ,Studio 3Hz,"Drama, Fantasy, Slice of Life, Original Work",3.29,2014.0
8925,TV   ,Production I.G,"Sci Fi, Proxy Battles, Based on a Video Game",3.29,2000.0
8930,TV   ,Nippon Animation,"Slice of Life, Art, Death of a Loved One, School Club, Based on a Manga",3.29,2021.0
8931,TV   ,8-Bit,"Adventure, Seinen, Slice of Life, Childhood Friends, Iyashikei, Mountain Climbing, Short Episodes, The Great Outdoors, Based on a Manga",3.29,2013.0
8932,TV   ,W.Baba,"Adventure, Animal Protagonists, Anthropomorphic, Family Friendly, Insects, Non-Human Protagonists, Outer Space, CG Animation, Original Work",3.29,2018.0
8937,TV   ,Studio Comet,"Comedy, Fantasy, Family Friendly, Person in a Strange World",3.29,1997.0
8938,TV   ,Toei Animation,"Adventure, England, Europe, Family Friendly, Original Work",3.29,1981.0
8940,TV   ,Nippon Animation,"Adventure, Desert, Family Friendly, Middle Eastern",3.29,1975.0
8943,Movie,Project Team Sara,"Adventure, Fantasy, Family Friendly, Shorts, Original Work",3.29,1998.0
8947,TV   ,OLM,"Romance, School Life, Based on an Eroge, Based on a Visual Novel",3.29,2005.0
8948,TV   ,Nippon Animation,"Animal Protagonists, Countryside, Episodic, Family Friendly, Forest, Non-Human Protagonists, Based on a Novel",3.29,1979.0
8949,Movie,Jinni's,"Action, Sci Fi, Seinen, Cyberpunk, Cyborgs, Police, Recap, Terrorism, Based on a Manga, CG Animation",3.29,2011.0
8951,TV   ,DLE,"Comedy, Animal Protagonists, Anthropomorphic, Non-Human Protagonists, Pigs, Short Episodes",3.29,2015.0
8957,TV   ,Ashi Productions,"Action, Mecha, Sci Fi, Non-Human Protagonists, Robots, Sentient Mecha, Super Robot, Transforming Mecha, War",3.29,1999.0
8959,TV   ,Sunrise,Sci Fi,3.29,1990.0
8961,Movie,OLM,"Adventure, Fantasy, Shounen, Elemental Powers, Family Friendly, Monsters, Based on a Video Game, CG Animation",3.29,2019.0
8963,TV   ,Group TAC,"Comedy, Animal Protagonists, Birds, Gag, Non-Human Protagonists, Satire",3.29,1999.0
8965,TV   ,Toei Animation,"Adventure, Cars, Episodic, Family Friendly, Police, Short Episodes, Original Work",3.29,2000.0
8966,TV   ,Studio! Cucuri,"Slice of Life, Cats, Family Life, Historical, Island, Short Episodes, Based on a Manga",3.29,2016.0
8970,TV   ,Sunrise,"Action, Reincarnation",3.29,1995.0
8973,TV   ,Kachidoki Studio,"Comedy, Animal Protagonists, Anthropomorphic, Non-Human Protagonists, Short Episodes",3.29,2020.0
8977,Movie,Studio Comet,"Action, Hand to Hand Combat, Martial Arts, Based on a Video Game",3.29,1994.0
8978,TV   ,DLE,"Comedy, Chibi, Parody, Short Episodes, Based on a Card Game, Flash Animation",3.29,2013.0
8979,TV   ,Ashi Productions,"Action, Mecha, Sci Fi, Non-Human Protagonists, Robots, Sentient Mecha, Super Robot, Transforming Mecha, War",3.29,1998.0
8981,Movie,Shirogumi,"Adventure, Animal Protagonists, Family Friendly, Non-Human Protagonists, CG Animation",3.29,2015.0
8983,TV   ,Group TAC,"Adventure, 19th Century, America, Countryside, Historical, Based on a Novel",3.29,1976.0
8986,TV   ,DLE,"Comedy, Animal Protagonists, Anthropomorphic, Non-Human Protagonists, Short Episodes, Work Life, Original Work",3.29,2016.0
8992,TV   ,Knack,"Comedy, Neighbors, Based on a 4-Koma Manga, Based on a Manga",3.29,1970.0
8995,TV   ,Studio DEEN,"Comedy, Shounen, Superheroes, Superpowers, Based on a Manga",3.28,1983.0
8997,TV   ,Jinni's,"Comedy, Slice of Life, Animal Protagonists, Dogs, Non-Human Protagonists, Short Episodes, Supernatural",3.28,2016.0
9001,Movie,Ajia-do,"Fantasy, Seinen, 19th Century, Boarding House, England, Europe, Historical, Neighbors, Based on a Manga",3.28,1992.0
9014,Movie,Toei Animation,"Adventure, Comedy, Sci Fi, Shounen, Based on a Manga",3.28,1981.0
9016,TV   ,Gathering,"Comedy, Seinen, Feudal Japan, Historical, Parody, Short Episodes, Based on a Manga",3.28,2011.0
9017,Movie,Gallop,"Action, Comedy, Sci Fi, Shounen, Cyborgs, Parody, School Life, Based on a Manga",3.28,1986.0
9024,TV   ,Studio DEEN,"Adventure, Fantasy, Sci Fi, Magic, Person in a Strange World, Based on a Video Game",3.28,2001.0
9031,TV   ,Studio Comet,"Fantasy, Animal Protagonists, Family Friendly, Non-Human Protagonists, Sanrio Characters, Original Work",3.28,2009.0
9036,Movie,Palm Studio,"Adventure, Fantasy, Non-Human Protagonists, Robots, Based on a Novel",3.28,2002.0
9038,TV   ,Group TAC,"Action, Comedy, Childhood Friends, Ninja, Based on a Light Novel",3.28,2006.0
9045,TV   ,Sunrise Beyond,"Mecha, Sci Fi, War, Original Work",3.28,2021.0
9047,TV   ,Kokusai Eigasha,"Action, Adventure, Mecha, Sci Fi, Motorcycles, Original Work",3.28,1982.0
9050,TV   ,Zexcs,"Comedy, Romance, Short Episodes, Based on a Visual Novel",3.28,2004.0
9053,TV   ,Toei Animation,"Action, Mecha, Sci Fi, Combining Mecha, Super Robot, Based on a Manga",3.28,1975.0
9054,TV   ,Toei Animation,"Action, Adventure, Shounen, Black and White, Ninja",3.28,1964.0
9055,Movie,Production I.G,"Action, Sci Fi, Historical, Power Suits, Based on a Visual Novel, Violence",3.28,2001.0
9056,TV   ,GEMBA,"Action, Adventure, Drama, Aviation, Bodyguards, CG Animation, Original Work",3.28,2019.0
9060,TV   ,Tezuka Productions,"Adventure, Fantasy, Family Friendly, Based on a Novel",3.28,1989.0
9061,TV   ,Studio Comet,"Comedy, Shounen, School Life, Based on a Manga",3.28,1985.0
9064,TV   ,Ashi Productions,"Magical Girl, Family Friendly, Henshin Heroes, Magic, Original Work",3.28,1990.0
9072,TV   ,Jinni's,"Comedy, Sci Fi, Androids, Episodic, Non-Human Protagonists, Robots, Short Episodes, CG Animation, Original Work",3.28,2011.0
9073,TV   ,Sunrise,"Comedy, Sci Fi, Shounen, Aliens, Frogs, Short Episodes, Based on a Manga",3.28,2014.0
9074,TV   ,St. Signpost,"Comedy, Seinen, Slice of Life, Animal Protagonists, Dogs, Martial Arts, Non-Human Protagonists, Reincarnation, Based on a Manga",3.28,2020.0
9077,TV   ,Usagi Ou,"Comedy, Sci Fi, Chibi, Family Friendly, Monsters, Short Episodes, Based on a Picture Book",3.28,2019.0
9082,TV   ,Tatsunoko Production,"Action, Sci Fi, Original Work",3.28,1978.0
9083,TV   ,Toei Animation,"Action, Adventure, Fantasy, Shounen, Family Friendly, Monster-of-the-week, Monsters",3.28,2006.0
9084,TV   ,SATELIGHT,"Action, Sci Fi, Aliens, Post-apocalyptic, Superpowers, Original Work",3.28,2007.0
9091,TV   ,Gallop,"Comedy, Sci Fi, Family Friendly, Based on a Manga",3.28,1988.0
9092,Movie,Pierrot,"Adventure, Dragons, Feudal Japan, Japanese Mythology, Original Work",3.28,2011.0
9095,TV   ,Studio DEEN,"Comedy, Crude, Short Episodes, Based on a Manga",3.28,1999.0
9098,TV   ,Yaoyorozu,"Comedy, Slice of Life, Breaking the Fourth Wall, Parody, School Club, School Life, CG Animation",3.28,2015.0
9103,TV   ,AIC PLUS+,"Comedy, Fantasy, Contemporary Fantasy, Short Episodes, Supernatural, Based on a Manga",3.28,2013.0
9104,Movie,AIC,"Sci Fi, Shounen, Police, Post-apocalyptic, Superpowers, Based on a Manga",3.28,1992.0
9107,TV   ,XEBEC M2,"Comedy, Drama, Seinen, School Club, School Life, Based on a Manga",3.28,2007.0
9111,TV   ,BEE TRAIN,"Europe, Political, Based on a Visual Novel",3.28,2006.0
9116,TV   ,Eiken,"Sci Fi, Time Travel, Original Work",3.28,1965.0
9118,TV   ,MADHOUSE,"Comedy, Romance, Sci Fi, Shounen, Time Travel, Based on a Manga",3.28,1994.0
9122,TV   ,DLE,"Comedy, Seinen, Short Episodes, Based on a 4-Koma Manga, Based on a Manga",3.28,2011.0
9125,TV   ,SATELIGHT,"Romance, Seinen, Slice of Life, School Life, Based on a Manga",3.28,2015.0
9128,TV   ,DR Movie,"Action, Adventure, Fantasy, Korean Animation, Thieves",3.28,2003.0
9130,TV   ,Toei Animation,"Action, Adventure",3.28,2007.0
9134,Movie,MADHOUSE,"Drama, Shoujo, Sports, School Life, Tennis, Based on a Manga",3.28,1979.0
9137,TV   ,AIC ASTA,"Romance, Androids, Love Triangle, Non-Human Protagonists, Robots, School Life, Based on a Visual Novel",3.28,2004.0
9153,Movie,Studio Korumi,"Adventure, Animal Protagonists, Family Friendly, Non-Human Protagonists",3.28,1981.0
9154,TV   ,Shin-Ei Animation,"Mystery, Anime no Me, Detectives, Original Work",3.28,2016.0
9157,TV   ,Kitty Film Mitaka Studio,"Romance, Shounen, School Life, Based on a Manga",3.28,1983.0
9158,TV   ,J.C.Staff,"Comedy, Romance, Childhood Friends, School Life, Based on a Manga",3.28,2003.0
9162,Movie,Toei Animation,"Black and White, Japanese Mythology, Supernatural, Youkai",3.28,1968.0
9163,TV   ,Lesprit,"Comedy, Ecchi, Romance, Crude, School Club, School Life, Short Episodes, Based on a Manga",3.28,2019.0
9165,TV   ,Nippon Animation,"Adventure, Drama, America, Animal Protagonists, Bears, Countryside, Family Friendly, Historical, Non-Human Protagonists, Based on a Novel",3.28,1977.0
9166,TV   ,production doA,"Action, Fantasy, Magical Girl, Shounen, Animeism, Dark Fantasy, Henshin Heroes, Urban Fantasy, Based on a Manga, Animal Abuse,, Bullying,, Mature Themes,, Physical Abuse,, Sexual Abuse,, Suicide,, Violence,, Domestic Abuse,, Self-Harm",3.28,2018.0
9168,TV   ,Fall 2007,"Adventure, Family Friendly, Short Episodes, Based on a Picture Book",3.28,2017.0
9170,TV   ,SHAFT,"Comedy, Seinen, Slice of Life, Cooking, Food and Beverage, Iyashikei, Based on a 4-Koma Manga, Based on a Manga",3.28,2015.0
9171,TV   ,Tatsunoko Production,"Adventure, Fantasy",3.28,1976.0
9173,TV   ,Joker Films,"Comedy, Animal Protagonists, Anthropomorphic, Cats, Educational, Family Friendly, Feudal Japan, Historical, Non-Human Protagonists, Parody, Short Episodes, Based on a Manga",3.28,2016.0
9175,TV   ,Kachidoki Studio,"Comedy, Animal Protagonists, Non-Human Protagonists, Short Episodes",3.28,2015.0
9179,TV   ,Tatsunoko Production,"Comedy, Sci Fi, Monsters, Non-Human Protagonists, Short Episodes",3.28,1972.0
9180,TV   ,Tatsunoko Production,"Action, Sci Fi, Original Work",3.28,1972.0
9181,TV   ,Quad,"Action, Comedy, Sci Fi, Seinen, Monsters, Work Life, Based on a Manga, Nudity",3.28,2022.0
9183,TV   ,A-1 Pictures,"Mystery, Psychic Powers, Supernatural, Superpowers, Based on a Video Game, Drug Use,, Mature Themes",3.28,2008.0
9191,TV   ,Tele-Cartoon Japan,"Action, Adventure, Historical, Martial Arts, Ninja, Samurai, Based on a Manga",3.27,1969.0
9192,Movie,SILVER LINK.,"Mystery, Sci Fi, Psychological, Based on a Visual Novel, Violence",3.27,2017.0
9194,Movie,Toei Animation,"Action, Adventure, Fantasy, Monsters",3.27,1963.0
9195,TV   ,GONZO,"Action, Adventure, Mecha, Sci Fi, Combining Mecha, Non-Human Protagonists, Outer Space, Robots, Sentient Mecha, Super Robot, Transforming Mecha, War",3.27,2005.0
9200,TV   ,XEBEC,"Action, Sci Fi, Androids, Non-Human Protagonists, Robots, Based on a Light Novel",3.27,2017.0
9202,TV   ,Studio Gokumi,"Action, Monsters, School Life, Supernatural, Swordplay, Original Work",3.27,2018.0
9203,TV   ,Studio Houkiboshi,"Romance, Borderline H, Childhood Friends, Short Episodes, Siblings, Based on a Manga, Explicit Sex",3.27,2020.0
9207,TV   ,Winter 2005,"Comedy, Family Friendly",3.27,2005.0
9211,TV   ,Doga Kobo,"Fantasy, Slice of Life, Anthropomorphic, Episodic, Historical, Swordplay, Based on a Video Game",3.27,2016.0
9212,TV   ,Actas,"Shounen, Sports, College, Cycling, Based on a Manga",3.27,2016.0
9213,TV   ,Toei Animation,"Sci Fi, Cyborgs, Superpowers, Original Work",3.27,1973.0
9214,TV   ,Kokusai Eigasha,"Adventure, Shoujo, Historical, Based on a Manga",3.27,1981.0
9221,TV   ,Ashi Productions,"Magical Girl, Family Friendly, Henshin Heroes, Magic, Original Work",3.27,1992.0
9222,Movie,TMS Entertainment,"Action, Seinen, Assassins, Guns, Noir, Based on a Manga, Explicit Sex,, Mature Themes,, Physical Abuse,, Sexual Abuse,, Suicide,, Violence",3.27,1983.0
9224,TV   ,ILCA,"Horror, Episodic, Short Episodes, Supernatural, Urban Legend, Original Work",3.27,2014.0
9230,TV   ,DLE,"Comedy, Animal Protagonists, Anthropomorphic, Non-Human Protagonists, Pigs, Short Episodes",3.27,2016.0
9236,Movie,CoMix Wave Films,"Romance, Sci Fi, Non-Human Protagonists, Robots, Shorts",3.27,2010.0
9237,TV   ,Toei Animation,"Action, Mecha, Sci Fi, Combining Mecha, Non-Human Protagonists, Robots, Sentient Mecha, Super Robot, Transforming Mecha, War",3.27,1987.0
9238,TV   ,Tatsunoko Production,"Romance, Shoujo, Sports, Gymnastics, Love Triangle, Based on a Manga",3.27,1986.0
9243,TV   ,ufotable,"Comedy, Harem, Romance, School Life, Original Work",3.27,2004.0
9248,Movie,Nippon Animation,"Fantasy, Dragon Quest",3.27,1996.0
9250,TV   ,Gathering,"Slice of Life, Chibi, Idols, Music, Short Episodes",3.27,2017.0
9251,TV   ,Sunrise,"Action, Sci Fi, Superheroes",3.27,1989.0
9261,TV   ,Lerche,"Action, Comedy, Mecha, Sci Fi, Military, Otaku Culture, Original Work",3.27,2021.0
9265,Movie,Shanghai Animation Film Studio,"Chinese Animation, Shorts",3.27,1963.0
9266,Movie,Toei Animation,"Sci Fi, Shounen, Outer Space, Psychic Powers, Superpowers, Based on a Manga, Nudity",3.27,1980.0
9267,TV   ,Toei Animation,"Comedy, Romance, Shounen, Magic, Based on a Manga",3.27,1998.0
9268,TV   ,aNCHOR,"Action, Drama, Mecha, Sci Fi, Based on an Eroge, Based on a Visual Novel, Mature Themes,, Physical Abuse,, Sexual Abuse,, Sexual Content,, Violence",3.27,2016.0
9269,TV   ,WHITE FOX,"Fantasy, Magical Girl, Henshin Heroes, Magic, Supernatural, Original Work",3.27,2016.0
9271,Movie,Sunrise,"Action, Sci Fi, Superpowers, Original Work",3.27,2012.0
9274,TV   ,Amber Film Works,"Action, Mecha, Sci Fi, Superpowers, Original Work",3.27,2003.0
9275,Movie,SATELIGHT,"Action, Mecha, Sci Fi, Aliens, Idols, Music, Transforming Mecha",3.27,2012.0
9278,TV   ,Knack,"Action, Mecha, Sci Fi, Monster-of-the-week, Original Work",3.27,1972.0
9284,Movie,MADHOUSE,"Action, Shoujo, Supernatural, Superpowers, Based on a Manga, Explicit Violence",3.27,1996.0
9289,TV   ,Kinema Citrus,"Adventure, Drama, Mystery, Romance, Sci Fi, Supernatural, Superpowers, Based on an Otome Game, Based on a Visual Novel",3.27,2016.0
9295,TV   ,TMS Entertainment,"Comedy, Animal Protagonists, Anthropomorphic, Episodic, Family Friendly, Non-Human Protagonists, Rabbits, Based on a Manga",3.27,2008.0
9298,TV   ,Kachidoki Studio,"Comedy, Romance, Slice of Life, Adult Couples, Aging, Married Life, Mature Romance, Short Episodes, Based on a Manga",3.27,2020.0
9300,TV   ,Studio Hibari,"Comedy, Ecchi, Sci Fi, Seinen, Panty Shots, Based on a Manga, Nudity",3.27,2009.0
9307,TV   ,Toei Animation,"Action, Sci Fi, Shounen, Monsters, Based on a Video Game",3.27,2016.0
9310,Movie,Pierrot,Sci Fi,3.27,1999.0
9311,TV   ,Brain's Base,"Action, Mecha, Sci Fi, Proxy Battles, Tournaments, Original Work",3.27,2002.0
9314,TV   ,Radix Ace Entertainment,"Drama, Idols, Music",3.27,2006.0
9322,Movie,Ascension,"Action, Comedy, Anime Tamago, Martial Arts, Shorts, Original Work",3.27,2011.0
9326,TV   ,DLE,"Comedy, Animal Protagonists, Anthropomorphic, Non-Human Protagonists, Pigs, Short Episodes, Flash Animation",3.27,2017.0
9332,TV   ,SATELIGHT,"Adventure, Fantasy, Shounen, Isekai, Person in a Strange World, Based on a Manga",3.27,2013.0
9334,TV   ,Sunrise,"Time Travel, Based on a Card Game",3.27,2010.0
9335,Movie,Tezuka Productions,"Animal Protagonists, Environmental, Forest, Non-Human Protagonists, Shorts, Original Work",3.27,1988.0
9336,TV   ,Sunrise,"Mecha, Sci Fi, Original Work",3.27,2011.0
9338,TV   ,St. Signpost,"Action, Adventure, Comedy, Fantasy, Shounen, Episodic, Island, Superpowers, Based on a Manga",3.27,2019.0
9345,Movie,Toei Animation,"Action, Sci Fi, Shounen, Cyborgs, Superheroes, Based on a Manga",3.27,1980.0
9350,TV   ,Gallop,"Adventure, Historical, Based on a Novel",3.27,1987.0
9351,Movie,TMS Entertainment,"Animal Protagonists, Bears, Family Friendly, Non-Human Protagonists, Pandas, Original Work",3.27,1973.0
9353,TV   ,Studio 4°C,"Comedy, Food and Beverage, Promotional, Sentai, Short Episodes, Superheroes, Tokusatsu, Tourism, Original Work",3.27,2017.0
9359,Movie,Synergy SP,"Action, Adventure, Sci Fi, Shounen, Monsters, Proxy Battles, Based on a Manga",3.27,2010.0
9362,Movie,Toei Animation,"Japanese Mythology, Supernatural, Youkai",3.27,1980.0
9366,TV   ,Sunny Gapen,"Family Friendly, Frogs, Short Episodes, Original Work",3.27,2020.0
9371,TV   ,GONZO,"Action, Sci Fi, Demons, Europe, Germany, Motorcycles, Racing, Original Work",3.27,2008.0
9372,TV   ,DLE,"Family Friendly, Family Life, Hotels and Inns, Lifestyle Change, Orphans, Short Episodes, Supernatural, Based on a Light Novel",3.26,2018.0
9375,TV   ,Toei Animation,"Action, Adventure, Sci Fi, Shounen, Family Friendly, Monster-of-the-week, Monsters",3.26,2010.0
9378,TV   ,Ashi Productions,"Action, Sci Fi, Monster-of-the-week, Superheroes, Original Work",3.26,1988.0
9385,TV   ,Nippon Animation,"Adventure, Comedy, Sci Fi, Anthropomorphic, Astronauts, Outer Space, Based on a Comic Book",3.26,1986.0
9389,TV   ,Winter 2009,"Comedy, Short Episodes, Superheroes, Original Work",3.26,2009.0
9390,Movie,OLM,"Fantasy, Animal Protagonists, Family Friendly, Monsters, Non-Human Protagonists, Shorts, Based on a Video Game",3.26,2000.0
9391,Movie,Nippon Animation,"Slice of Life, Family Friendly, Lifestyle Change",3.26,1992.0
9392,TV   ,OLM,"Fantasy, Slice of Life, Family Friendly",3.26,2015.0
9394,TV   ,TMS Entertainment,"Action, Adventure, Martial Arts",3.26,2009.0
9400,TV   ,J.C.Staff,"Comedy, Ecchi, Seinen, Panty Shots, Short Episodes, Based on a Manga, Nudity,, Sexual Content",3.26,1999.0
9402,Movie,Toei Animation,"Action, Mecha, Sci Fi, Combining Mecha, Crossover, Super Robot",3.26,1975.0
9403,TV   ,TMS Entertainment,"Action, Adventure, Shounen",3.26,1973.0
9411,TV   ,MADHOUSE,"Comedy, Aliens, Chibi, Episodic, Gag, Non-Human Protagonists, Short Episodes",3.26,1999.0
9412,TV   ,Studio DEEN,"Comedy, Ecchi, Crude, Short Episodes, Based on a Manga",3.26,1999.0
9413,TV   ,Group TAC,"Family Friendly, Historical, Japanese Mythology, Supernatural",3.26,1975.0
9425,TV   ,A.C.G.T,"Comedy, Romance, Shounen, Henshin Heroes, School Life, Split Personality, Superheroes, Supernatural, Superpowers, Original Work",3.26,2002.0
9432,Movie,Toei Animation,"Japanese Mythology, Supernatural, Youkai",3.26,2008.0
9433,TV   ,Pierrot,"Comedy, Sci Fi, Based on a Picture Book",3.26,1998.0
9434,TV   ,Group TAC,"Action, Adventure, Comedy, Ecchi, Shounen, Crude, Forest, Hand to Hand Combat, Jungle, Tournaments, Based on a Manga, Mature Themes,, Physical Abuse",3.26,1993.0
9435,Movie,Sunrise,"Mecha, Sci Fi",3.26,2001.0
9438,TV   ,TMS Entertainment,"Shoujo, Slice of Life, Family Friendly, Siblings, Based on a Novel",3.26,1991.0
9442,TV   ,Toei Animation,"Action, Mecha, Sci Fi, Outer Space, Super Robot",3.26,1977.0
9443,TV   ,Sunrise,"Action, Sci Fi, Police, Original Work",3.26,1991.0
9450,TV   ,Project No.9,"Comedy, Drama, Slice of Life, Music, Based on a Light Novel",3.26,2017.0
9458,TV   ,Millepensee,"Comedy, Shounen, Gag, School Club, School Life, Short Episodes, Based on a Manga",3.26,2015.0
9460,Movie,Pierrot,"Action, Sci Fi, Dystopia, Original Work",3.26,1985.0
9462,TV   ,A-1 Pictures,"Action, Sci Fi, School Life, Superpowers, Based on a Light Novel",3.26,2016.0
9463,TV   ,Magic Bus,"Action, Ecchi, Police, Original Work, Violence",3.26,1997.0
9471,TV   ,MAPPA,"Comedy, Shounen, Gag, School Club, School Life, Short Episodes, Based on a Manga",3.26,2013.0
9473,TV   ,Studio Rong,"Comedy, Cars, Racing, Short Episodes",3.26,2008.0
9478,TV   ,Nippon Animation,"19th Century, Countryside, Europe, Family Friendly, Family Life, Historical, Orphans, Switzerland, World Masterpiece Theater, Based on a Novel",3.26,1974.0
9484,TV   ,Gathering,"Comedy, Slice of Life, Animal Protagonists, Cats, Family Friendly, Food Protagonists, Iyashikei, Non-Human Protagonists, Short Episodes, Original Work",3.26,2016.0
9486,TV   ,Lerche,"Mystery, Crime, Detectives, noitaminA, Drug Use,, Mature Themes,, Physical Abuse,, Violence,, Domestic Abuse",3.26,2015.0
9487,TV   ,St. Signpost,"Comedy, Seinen, School Life, Supernatural, Based on a Manga",3.26,2015.0
9488,TV   ,Bridge,"Comedy, Slice of Life, Animal Protagonists, Family Friendly, Non-Human Protagonists, Pets, Short Episodes, Based on a Manga",3.26,2017.0
9492,TV   ,Tezuka Productions,"Action, Shounen, Androids, Non-Human Protagonists, Robots, Superheroes, Based on a Manga",3.26,1980.0
9496,TV   ,Toei Animation,"Shounen, Sports, Hand to Hand Combat, Wrestling, Based on a Manga",3.26,2016.0
9498,Movie,Toei Animation,Comedy,3.26,1999.0
9499,Movie,Shanghai Animation Film Studio,"Fantasy, Chinese Animation, Shorts",3.26,1981.0
9503,Movie,Sunrise,"Action, Mecha, Sci Fi, Military, Political",3.26,2002.0
9505,Movie,Ashi Productions,"Action, Sci Fi, Original Work, Violence",3.26,1985.0
9506,Movie,Toei Animation,"BL, Comedy, Romance, Shoujo, Shounen-ai, Based on a Manga",3.26,1983.0
9514,TV   ,Hoods Entertainment,"Action, Ecchi, Shounen, All-Girls School, Borderline H, Fetish, Panty Shots, Supernatural, Superpowers, Based on a Manga, Explicit Sex,, Violence",3.26,2011.0
9516,TV   ,Pierrot,"Adventure, Countryside, Europe, Family Friendly",3.26,1980.0
9517,TV   ,GONZO,"Action, Comedy, Ecchi, Fantasy, Otaku Culture, Parody, Vampires, Based on a Video Game, Nudity",3.26,2017.0
9532,TV   ,DLE,"Family Friendly, Short Episodes",3.26,2015.0
9534,TV   ,Knack,"Adventure, Animal Protagonists, Anthropomorphic, Family Friendly, Non-Human Protagonists",3.26,1975.0
9539,TV   ,Shin-Ei Animation,"Comedy, Shounen, Thieves, Based on a Manga",3.26,2014.0
9540,Movie,TMS Entertainment,"Animal Protagonists, Family Friendly, Hamsters, Non-Human Protagonists, Based on a Manga",3.26,2003.0
9541,Movie,Tezuka Productions,"Environmental, Shorts",3.26,1984.0
9542,TV   ,TMS Entertainment,"Sci Fi, Psychic Powers, School Life, Supernatural, Superpowers, Based on a Novel",3.26,2008.0
9545,TV   ,Toei Animation,"Animal Protagonists, Anthropomorphic, Bears, Black and White, Cats, Family Friendly, Non-Human Protagonists, Based on a Manga",3.26,1965.0
9546,TV   ,Dongwoo A&E,Family Friendly,3.25,2012.0
9553,TV   ,Sunrise,"Dinosaurs, Family Friendly, Based on a Video Game",3.25,2008.0
9556,TV   ,Nippon Animation,"Comedy, Slice of Life, Animal Protagonists, Dogs, Non-Human Protagonists, Short Episodes, Based on a Novel",3.25,2010.0
9557,TV   ,Ashi Productions,"Fantasy, Magical Girl, Age Transformation, Contemporary Fantasy, Henshin Heroes, Magic, Original Work",3.25,1982.0
9560,TV   ,Toei Animation,"Action, Adventure, Europe, Historical",3.25,1979.0
9566,TV   ,Studio Crocodile,"Adventure, Comedy, Anthropomorphic, Food Protagonists, Non-Human Protagonists, Short Episodes, Work Life, Original Work",3.25,2018.0
9568,TV   ,OLM,"Romance, Shoujo, School Life, Based on a Manga",3.25,2016.0
9569,TV   ,Studio Houkiboshi,"Josei, Romance, Childhood Friends, Firefighters, Short Episodes, Smut, Based on a Manga, Explicit Sex",3.25,2019.0
9570,Movie,TMS Entertainment,"Animal Protagonists, Family Friendly, Hamsters, Non-Human Protagonists",3.25,2004.0
9574,TV   ,Nippon Animation,Family Friendly,3.25,1976.0
9578,Movie,OLM,"Adventure, Fantasy, Animal Protagonists, Family Friendly, Monsters, Non-Human Protagonists, Based on a Video Game",3.25,1999.0
9582,TV   ,Production I.G,"Action, Horror, Mystery, Supernatural, Swordplay, Explicit Violence",3.25,2011.0
9583,TV   ,Kokusai Eigasha,"Action, Adventure, Mecha, Sci Fi, Outer Space, Original Work",3.25,1981.0
9588,TV   ,Telecom Animation Film,"Action, Adventure, Sci Fi, Military, Ocean, Post-apocalyptic, Submarine, War, Original Work",3.25,2005.0
9592,TV   ,Seven,"Comedy, Seinen, Slice of Life, School Life, Short Episodes, Siblings, Based on a 4-Koma Manga, Based on a Manga",3.25,2012.0
9594,TV   ,Millepensee,"Comedy, Shounen, Gag, School Club, School Life, Short Episodes, Based on a Manga",3.25,2015.0
9596,TV   ,GONZO,"Comedy, Mecha, Sci Fi, Original Work",3.25,2004.0
9597,TV   ,Shirogumi,"Sci Fi, Psychic Powers, Siblings, Based on a TV Series, CG Animation",3.25,2021.0
9604,TV   ,TMS Entertainment,"Action, Adventure, Fantasy, Monster-of-the-week, Monsters, Person in a Strange World, Based on a Video Game",3.25,1999.0
9605,TV   ,GAINAX,"Comedy, Ecchi, Harem, Shounen, Debt, Lifestyle Change, Maids, Mansion, Based on a Manga, Nudity",3.25,2005.0
9612,TV   ,J.C.Staff,"Comedy, Seinen, School Life, Based on a 4-Koma Manga, Based on a Manga",3.25,2004.0
9613,TV   ,GAINAX,"Comedy, Seinen, Guns, School Club, School Life, Based on a Manga",3.25,2013.0
9617,TV   ,OLM,"Fantasy, Slice of Life, Family Friendly",3.25,2015.0
9618,TV   ,TMS Entertainment,"Adventure, Mecha, Sci Fi, Combining Mecha, Episodic, Non-Human Protagonists, Robots, Sentient Mecha, Super Robot, Transforming Mecha",3.25,1984.0
9623,TV   ,Fanworks,"Slice of Life, Animal Protagonists, Anthropomorphic, Dinosaurs, Non-Human Protagonists, Roommates, Short Episodes, Original Work",3.25,2021.0
9629,Movie,Toei Animation,"Drama, Romance, America, Based on a Novel",3.25,1978.0
9633,TV   ,Tatsunoko Production,"Comedy, Animal Protagonists, Dragons, Family Friendly, Non-Human Protagonists, Original Work",3.25,1987.0
9636,TV   ,Studio Hibari,"Comedy, Based on a Manga",3.25,2005.0
9637,TV   ,LIDEN FILMS,"Comedy, Slice of Life, Androids, Idols, Music, Non-Human Protagonists, Robots, Short Episodes, Showbiz, Vocaloid, Original Work",3.25,2015.0
9638,Movie,Production I.G,"Action, Sci Fi, Aliens, Outer Space, Based on a Video Game",3.25,2012.0
9640,TV   ,Usagi Ou,"Adventure, Fantasy, Animal Protagonists, Family Friendly, Non-Human Protagonists, Short Episodes",3.25,2015.0
9646,TV   ,J.C.Staff,"Action, Ecchi, Sci Fi, Bounty Hunters, Original Work",3.25,2004.0
