,Type,Studio,Tags,Rating,Release_year
4725,TV   ,Kyoto Animation,"Action, Comedy, Ecchi, Fantasy, Magic, School Club, School Life, Supernatural, Based on a Light Novel",3.53,2016.0
4726,TV   ,Toei Animation,"Action, Adventure, Sci Fi, Shounen, Family Friendly, Monster-of-the-week, Monsters",3.53,2011.0
4734,TV   ,Lerche,"Action, Fantasy, Magical Girl, Battle Royale, Contemporary Fantasy, Dark Fantasy, Henshin Heroes, Magic, Melancholy, PVP, Urban Fantasy, Based on a Light Novel, Violence",3.53,2016.0
4738,TV   ,CloverWorks,"Action, School Life, Secret Identity, Supernatural, Thieves, Vigilantes, Based on a Video Game, Mature Themes,, Physical Abuse",3.53,2018.0
4744,TV   ,Toei Animation,"Action, Demons, School Life, Supernatural, Based on a Manga",3.53,1996.0
4746,TV   ,Gallop,"Shounen, Card Battles, High Stakes Games, Based on a Manga",3.53,2014.0
4747,Movie,Shin-Ei Animation,"Adventure, Comedy, Crude, Forest, Island, Jungle",3.53,2000.0
4748,Movie,Studio Ghibli,"Action, Drama, Fantasy, Based on a Novel, Violence",3.53,2006.0
4750,TV   ,Fall 1997,"Adventure, Based on a Novel",3.53,1997.0
4756,Movie,Shin-Ei Animation,"Adventure, Comedy, Shounen, Family Friendly, Superheroes, Superpowers",3.52,1983.0
4762,TV   ,Spring 2000,"Comedy, Historical",3.52,2000.0
4764,TV   ,Nippon Animation,"Drama, Slice of Life, Age Gap, Boss-Employee Relationship, Childcare, Countryside, Europe, Family Friendly, Family Life, Historical, Lifestyle Change, Mansion, Music, Social Gap, War, World Masterpiece Theater, World War 2, Based on a Novel",3.52,1991.0
4766,Movie,Studio Ponoc,"Fantasy, Sports, Family Friendly, Promotional, Shorts",3.52,2021.0
4767,TV   ,Sunrise,"Action, Mecha, Sci Fi, Combining Mecha, Monsters, Super Robot",3.52,1976.0
4768,Movie,Group TAC,"Fantasy, Animal Protagonists, Anthropomorphic, Cats, Family Friendly, Non-Human Protagonists, Trains, Based on a Novel",3.52,1985.0
4769,TV   ,Ezo'la,"Drama, GL, Horror, Mystery, Romance, Shoujo-ai, Shounen, Age Gap, Codependency, Mental Illness, Obsessive Love, Psychological, Psychopaths, Star-Crossed Lovers, Based on a Manga, Mature Themes,, Physical Abuse,, Sexual Abuse,, Sexual Content,, Suicide,, Violence,, Domestic Abuse",3.52,2018.0
4771,TV   ,Sunrise,"Mecha, Sci Fi, Super Robot, Original Work",3.52,1977.0
4774,TV   ,Fall 1997,"Action, Adventure, Fantasy, Korean Animation",3.52,1997.0
4779,Movie,Triangle Staff,"Fantasy, Animal Protagonists, Animal Transformation, Anthropomorphic, Cats, Family Friendly, Non-Human Protagonists, Person in a Strange World, Siblings",3.52,1995.0
4787,TV   ,BEE TRAIN,"Action, Adventure, Bounty Hunters, Guns, Psychic Powers, Superpowers, Original Work",3.52,2007.0
4788,TV   ,Studio DEEN,"Action, Adventure, Comedy, Fantasy, Shounen, Based on a Manga",3.52,1999.0
4789,Movie,Shin-Ei Animation,"Adventure, Sci Fi, Shounen, Cats, Family Friendly, Non-Human Protagonists, Robots, Trains, Based on a Manga",3.52,1996.0
4791,TV   ,Seven Arcs,"Action, Drama, Mecha, Mystery, Sci Fi, Based on a Light Novel",3.52,2009.0
4794,TV   ,XEBEC,"Action, Adventure, Comedy, Sci Fi, Proxy Battles",3.52,2003.0
4797,TV   ,Actas,"Magical Girl, Shoujo, Family Friendly, Henshin Heroes, Magic, Mermaids, Music, Sentai, Superheroes, Tokusatsu, Based on a Manga",3.52,2004.0
4799,TV   ,feel.,"Comedy, Romance, All-Girls School, Boarding School, Crossdressing, School Life, Based on an Eroge, Based on a Visual Novel",3.52,2006.0
4801,TV   ,J.C.Staff,"Action, Fantasy, Dragons, Magic, Based on a Light Novel",3.52,1998.0
4804,Movie,Shin-Ei Animation,"Adventure, Shounen, Cats, Family Friendly, Mermaids, Non-Human Protagonists, Ocean, Robots, Based on a Manga",3.52,2010.0
4808,TV   ,Creative Power Entertaining,"Adventure, Animal Protagonists, Anthropomorphic, Chinese Animation, Family Friendly, Non-Human Protagonists, Original Work",3.52,2005.0
4809,Movie,Triangle Staff,"Drama, Fantasy, Animal Protagonists, Divorce, Dogs, Non-Human Protagonists, Pets, Based on a Novel",3.52,1995.0
4811,Movie,G&G Entertainment,"Action, Adventure, Fantasy, Greek Mythology, Korean Animation",3.52,2005.0
4813,TV   ,TMS Entertainment,"Action, Mecha, Sci Fi",3.52,1994.0
4815,TV   ,Toei Animation,"Adventure, Shounen, Black and White, Pirates, Original Work",3.52,1966.0
4817,TV   ,Tsuchida Production,"Animal Protagonists, Bears, Family Friendly, Non-Human Protagonists, Pandas",3.52,1983.0
4818,TV   ,Sunrise,"Action, Comedy, Sci Fi, Historical, Original Work",3.52,2000.0
4821,TV   ,XEBEC,"Action, Comedy, Ecchi, Shounen, Sports, Boarding School, School Life, Tournaments, Based on a Manga",3.52,2016.0
4822,Movie,Group TAC,"Action, Hand to Hand Combat, Martial Arts, Based on a Video Game",3.52,1994.0
4823,TV   ,Spring 2006,"Slice of Life, Animal Protagonists, Family Friendly, Hamsters, Non-Human Protagonists, Pets, Short Episodes, Based on a Manga",3.52,2006.0
4825,TV   ,Studio DEEN,"BL, Romance, Shoujo, Shounen-ai, Adult Couples, Cohabitation, LGBT Themes, Mature Romance, Music, Opposites Attract, Rock Music, Showbiz, Writers, Based on a Manga, Emotional Abuse,, Mature Themes,, Physical Abuse,, Sexual Abuse,, Sexual Content",3.52,2000.0
4827,TV   ,OLM,"Adventure, Fantasy, Shounen, Elemental Powers, Family Friendly, Monster-of-the-week, Monsters, Proxy Battles, Based on a Video Game",3.52,2013.0
4831,TV   ,Studio DEEN,"Action, Adventure, Seinen, Hand to Hand Combat, Martial Arts",3.52,1998.0
4832,TV   ,TMS Entertainment,"Comedy, Mystery, Journalism",3.52,1991.0
4833,TV   ,Studio DEEN,"Comedy, Anthropomorphic, Gag, Historical, Non-Human Protagonists, Parody, Political, Satire, Based on a Manga",3.52,2021.0
4834,TV   ,GONZO,"Fantasy, Sci Fi, Outer Space, Superpowers, Original Work",3.52,2002.0
4836,TV   ,Toei Animation,"Comedy, Slice of Life",3.52,1989.0
4839,Movie,TMS Entertainment,"Action, Adventure, Criminals, Thieves, Based on a Manga, Nudity",3.52,1978.0
4840,TV   ,Felix Film,"Comedy, Slice of Life, Animal Characteristics, Cafe, Based on an Eroge, Based on a Visual Novel",3.52,2020.0
4842,Movie,Shin-Ei Animation,"Adventure, Comedy, Fantasy, Horror, Shounen, Parody, Based on a Manga",3.52,1982.0
4843,TV   ,diomedea,"Comedy, Drama, Ecchi, Seinen, Age Gap, School Life, Student-Teacher Relationship, Based on a Manga, Sexual Content",3.52,2007.0
4844,Movie,Shin-Ei Animation,"Adventure, Comedy, Sci Fi, Shounen, Cats, Family Friendly, Non-Human Protagonists, Robots, Based on a Manga",3.52,1981.0
4847,Movie,Toei Animation,"Action, Shounen, Aliens, Hand to Hand Combat, Martial Arts, Superpowers, Based on a Manga",3.52,1992.0
4850,Movie,Tatsunoko Production,"Idols, Music, Showbiz",3.52,2019.0
4851,TV   ,PRA,"Slice of Life, Idols, Music, Showbiz",3.52,2021.0
4852,Movie,Yokohama Animation Lab,"Action, Historical, Middle Eastern, Religion, Swordplay, War, Original Work, Violence",3.52,2021.0
4853,TV   ,Pierrot,"Action, Mecha, Sci Fi, Family Friendly, Superheroes, Superpowers",3.52,1999.0
4856,Movie,Toei Animation,"Adventure, Drama, Shounen, Buddhism, Coming of Age, Historical, India, Political, Poverty, Psychic Powers, Religion, Royalty, Superpowers, War, Based on a Manga, Mature Themes,, Physical Abuse,, Violence",3.52,2011.0
4857,TV   ,asread,"Comedy, Ecchi, Fantasy, Seinen, Contemporary Fantasy, Coworkers, Demons, Magic, Panty Shots, Urban Fantasy, Work Life, Based on a Light Novel, Nudity",3.52,2013.0
4861,TV   ,Studio Comet,"Comedy, Fantasy, Aliens, All-Boys School, Contemporary Fantasy, Gag, Henshin Heroes, Magic, Parody, School Club, School Life, Original Work",3.52,2016.0
4862,TV   ,Seven Arcs,"Action, Adventure, Ecchi, Fantasy, Animal Characteristics, Animal Transformation, Isekai, Magic, Non-Human Protagonists, Person in a Strange World, Royalty, Summoned Into Another World, War, Original Work",3.52,2011.0
4863,TV   ,Toei Animation,"Drama, Sci Fi, Political, CG Animation, Original Work",3.52,2017.0
4864,Movie,Shin-Ei Animation,"Adventure, Comedy, Shounen, Cats, Family Friendly, Non-Human Protagonists, Robots, Based on a Manga",3.52,1982.0
4865,TV   ,Animation 21,"Comedy, Family Friendly, Short Episodes, Based on a Manga",3.52,1993.0
4868,TV   ,Studio Hibari,"Ecchi, Music, Original Work",3.51,2006.0
4869,TV   ,Sunrise,"Action, Fantasy, Demons, Feudal Japan, Siblings, Supernatural, Time Travel",3.51,2020.0
4871,TV   ,Studio Comet,"Shounen, Sports, Soccer, Based on a Manga",3.51,1994.0
4872,TV   ,MADHOUSE,"Comedy, Sci Fi, Episodic, Outer Space",3.51,2002.0
4876,TV   ,Kachidoki Studio,"Slice of Life, Animal Protagonists, Forest, Non-Human Protagonists, Rabbits, Short Episodes, Based on a Manga",3.51,2018.0
4879,Movie,Toei Animation,"Shounen, Sports, Hand to Hand Combat, Recap, Wrestling, Based on a Manga",3.51,1970.0
4881,TV   ,Trans Arts,"Comedy, Original Work",3.51,2007.0
4882,Movie,GONZO,"Adventure, Fantasy, Sci Fi, Aviation, Military, Recap, Steampunk",3.51,2016.0
4883,TV   ,Tatsunoko Production,"Family Friendly, Fashion, Idols, Magic, Music, Showbiz, Based on a Video Game",3.51,2021.0
4885,TV   ,Sunrise,"Action, Mecha, Sci Fi, Amnesia, Androids, Episodic, Isolated Society, Noir, Non-Human Protagonists, Post-apocalyptic, Robots, Original Work",3.51,1999.0
4889,TV   ,Nippon Animation,"Adventure, Comedy, Dinosaurs, Historical, Prehistoric, Time Travel, Based on a Manga",3.51,1993.0
4894,Movie,Toei Animation,"Shounen, Sports, Hand to Hand Combat, Superheroes, Wrestling, Based on a Manga",3.51,2001.0
4896,TV   ,Studio DEEN,"Fantasy, GL, Shoujo-ai, Aviation, Coming of Age, LGBT Themes, Military, Original Work",3.51,2006.0
4897,TV   ,Studio Gokumi,"Drama, Ecchi, Romance, Sci Fi, Shounen, Pandemic, Post-apocalyptic, Terrorism, Based on a Manga",3.51,2022.0
4901,Movie,Toei Animation,"Magical Girl, Family Friendly, Magic, Mermaids",3.51,2021.0
4903,TV   ,Studio DEEN,"Seinen, Sports, Baseball, Work Life, Based on a Manga",3.51,2018.0
4904,TV   ,8-Bit,"Ecchi, Harem, Mecha, Sci Fi, All-Girls School, Boarding School, Power Suits, School Life, Based on a Light Novel",3.51,2013.0
4906,Movie,Tecarat,"Adventure, Fantasy, Family Friendly, Shorts, Stop Motion Animation, Original Work",3.51,2013.0
4911,TV   ,Marza Animation Planet,"Adventure, Comedy, Seinen, Slice of Life, Animal Protagonists, Cats, Family Friendly, Non-Human Protagonists, Pets, Based on a Manga, CG Animation",3.51,2016.0
4914,Movie,Magic Bus,"Comedy, Sports, Baseball",3.51,1984.0
4915,TV   ,A-Line,"Action, Tournaments",3.51,2001.0
4919,TV   ,Tatsunoko Production,"Comedy, Sci Fi, Superheroes",3.51,1986.0
4922,Movie,OLM,"Comedy, Family Friendly, Recap, Supernatural, Youkai, Based on a Video Game",3.51,2021.0
4923,Movie,Tezuka Productions,"Mecha, Sci Fi, Shounen, Based on a Manga",3.51,2013.0
4925,Movie,Toei Animation,"Action, Shounen, Detectives, Hotels and Inns",3.51,1999.0
4926,TV   ,J.C.Staff,"Drama, Card Battles, Psychological, Supernatural, Based on a Card Game",3.51,2018.0
4927,TV   ,Brain's Base,"Action, Comedy, Sci Fi, Seinen, Robots, Based on a Manga",3.51,2011.0
4930,Movie,Studio Dadashow,"Drama, Fantasy, Horror, Korean Animation",3.51,2006.0
4931,TV   ,Charaction,"Comedy, Animal Protagonists, Dogs, Family Friendly, Non-Human Protagonists, Short Episodes",3.51,2020.0
4932,TV   ,Bones,"Action, Mecha, Sci Fi, Aliens, Robots",3.51,2013.0
4933,TV   ,XEBEC,"Action, Sci Fi, Short Episodes, Superheroes",3.51,2007.0
4936,TV   ,Tsuchida Production,"Comedy, Educational, Historical",3.51,1980.0
4942,TV   ,Toei Animation,"Action, Adventure, Fantasy, Angels, Demons, Non-Human Protagonists",3.51,1992.0
4945,Movie,David Production,"Slice of Life, Based on a Novel",3.51,2021.0
4946,Movie,Gallop,"Family Friendly, Time Travel, Based on a Manga",3.51,2000.0
4947,TV   ,Studio DEEN,"Action, Ecchi, Fantasy, Harem, Animal Characteristics, Dragons, Magic, Based on a Light Novel",3.51,2010.0
4948,Movie,Sunrise,"Action, Mecha, Sci Fi, Recap",3.51,2019.0
4949,TV   ,Manglobe,"Comedy, Shounen, Butlers, Master-Servant Relationship, Based on a Manga",3.51,2013.0
4950,TV   ,MADHOUSE,"Adventure, Historical",3.51,1979.0
4951,Movie,Oh production,"Comedy, Family Friendly, Pigs",3.51,1988.0
4952,TV   ,Winter 2006,"Slice of Life, Short Episodes",3.51,2006.0
4954,Movie,MADHOUSE,"Action, Drama, Seinen, Sports, Cycling, Europe, Racing, Based on a Manga",3.51,2003.0
4957,Movie,Toei Animation,"Action, Comedy, Sci Fi, Shounen, Sports, Hand to Hand Combat, Superheroes, Superpowers, Wrestling",3.51,1986.0
4961,Movie,The Answer Studio,"Adventure, Fantasy, Animal Protagonists, Anthropomorphic, Family Friendly, Non-Human Protagonists",3.51,2014.0
4962,TV   ,Pierrot,"Action, Shounen, Elemental Powers, Hand to Hand Combat, Ninja, Superpowers, Tournaments, Based on a Manga",3.51,1997.0
4963,Movie,J.C.Staff,"Comedy, Mystery, Detectives, Sherlock Holmes",3.51,2016.0
4964,TV   ,Pierrot,"Comedy, Seinen, Historical, Prehistoric, Based on a Manga",3.51,1996.0
4965,Movie,Creative Power Entertaining,"Adventure, Animal Protagonists, Anthropomorphic, Chinese Animation, Family Friendly, Non-Human Protagonists, Outer Space",3.51,2011.0
4970,Movie,Ajia-do,"Adventure, Comedy, Animal Protagonists, Anthropomorphic, Family Friendly, Non-Human Protagonists, Pigs, Based on a Picture Book",3.51,2015.0
4980,TV   ,GONZO,"Action, Ecchi, Sci Fi, Aliens, Animal Characteristics, Guns, Historical, Magic, Military, Panty Shots, Original Work, Nudity",3.51,2008.0
4983,Movie,Toei Animation,"Japanese Mythology, Supernatural, Youkai",3.51,1997.0
4984,TV   ,Fall 2003,"Animal Protagonists, Anthropomorphic, Birds, Family Friendly, Non-Human Protagonists, Penguins, CG Animation",3.51,2002.0
4985,TV   ,Pierrot,"Fantasy, Proxy Battles, Tournaments, Based on a Video Game",3.51,2018.0
4986,TV   ,SILVER LINK.,"Action, Fantasy, Magical Girl, Shounen, Contemporary Fantasy, Henshin Heroes, Magic, Urban Fantasy, Based on a Manga",3.51,2013.0
4987,Movie,Toei Animation,"Action, Adventure, Shounen, Martial Arts, Based on a Manga",3.51,1988.0
4989,TV   ,TMS Entertainment,"Action, Fantasy, Card Battles, Family Friendly, Tournaments, Based on a Card Game",3.51,2012.0
4990,TV   ,A.C.G.T,"Action, BL, Comedy, Shoujo, Shounen-ai, Supernatural, Based on a Manga",3.51,2008.0
4992,TV   ,Nippon Animation,"Slice of Life, Art, School Club, Based on a Manga",3.51,2021.0
4993,TV   ,Tatsunoko Production,"Action, Mecha, Sci Fi, Aliens, Military, Real Robot",3.51,1985.0
4996,TV   ,Production I.G,"Action, Mecha, Sci Fi, Sports, Racing, Original Work",3.51,2005.0
4999,TV   ,J.C.Staff,"Shounen, Slice of Life, Boarding House, Cooking, Food and Beverage, Based on a Manga",3.51,2021.0
5001,Movie,OLM,"Adventure, Fantasy, Shounen, Elemental Powers, Family Friendly, Monsters, Based on a Video Game",3.51,2008.0
5002,TV   ,Asahi Production,"Action, Mecha, Sci Fi, Military, Based on a Video Game",3.51,2010.0
5003,Movie,Gallop,"Action, Comedy, Police",3.51,2003.0
5004,Movie,Shin-Ei Animation,"Adventure, Shounen, Cats, Dinosaurs, Family Friendly, Non-Human Protagonists, Robots, Based on a Manga",3.51,1987.0
5010,TV   ,Group TAC,"Seinen, Aviation, Military, Based on a Manga",3.51,2004.0
5011,TV   ,Brain's Base,"Drama, Sports, College, School Club, School Life, Tournaments, Based on a Novel",3.51,2016.0
5012,Movie,TMS Entertainment,"Adventure, Drama, 19th Century, Europe, France, Historical, Melancholy",3.51,1980.0
5014,TV   ,Alpha Group,"Chinese Animation, Proxy Battles, Tournaments",3.51,2015.0
5018,TV   ,A-1 Pictures,"Action, Sci Fi, Music",3.51,2020.0
5020,TV   ,Sunrise,"Comedy, Mecha, Sci Fi, Super Robot, Original Work",3.51,2000.0
5021,TV   ,BEE TRAIN,"Adventure, Fantasy, Sci Fi, Hacking, MMORPG, Person in a Strange World, RPG, Trapped in a Video Game, Virtual Reality",3.51,2002.0
5024,TV   ,Tomason,"Comedy, Drama, Fantasy, Episodic, Family Friendly, Japanese Mythology, Original Work",3.51,2012.0
5025,Movie,Toei Animation,"Action, Magical Girl, Family Friendly, Henshin Heroes, Magic",3.51,2005.0
5028,TV   ,OLM,"Drama, Sci Fi, Slice of Life, Aliens, Coming of Age, Countryside, Family Friendly, School Life, Original Work, Violence",3.51,2001.0
5029,Movie,Toei Animation,"Action, Shounen, Desert, Dystopia, Hand to Hand Combat, Martial Arts, Overpowered Main Characters, Post-apocalyptic, Based on a Manga, Explicit Violence,, Mature Themes,, Physical Abuse",3.51,1986.0
5030,TV   ,Pierrot,"Comedy, Sci Fi, Shounen, Superpowers, Based on a Manga",3.51,1994.0
5031,TV   ,AIC,"Sci Fi, Androids, Cyberpunk, Power Suits, Robots, Original Work",3.51,1998.0
5032,TV   ,Doga Kobo,"Comedy, Seinen, Slice of Life, All-Girls School, School Life, Based on a 4-Koma Manga, Based on a Manga",3.51,2016.0
5033,TV   ,Ordet,"Action, Drama, Fantasy, Slice of Life, Based on a Song, noitaminA, Psychological, School Life",3.51,2012.0
5035,Movie,AIC,"Action, Sci Fi, Androids, Cyberpunk, Non-Human Protagonists, Robots, Original Work",3.51,2002.0
5036,TV   ,Studio Comet,"Comedy, Romance, Seinen, Slice of Life, Astronomy, School Club, School Life, Based on a Manga",3.51,2009.0
5038,TV   ,CygamesPictures,"Action, Adventure, Comedy, Fantasy, Amnesia, Food and Beverage, Guilds, Magic, Monsters, Based on a Mobile Game",3.5,2020.0
5041,Movie,Studio 4°C,"Drama, Ship, Based on a Novel",3.5,2021.0
5045,Movie,Studio Ghibli,"Fantasy, Ghibli Museum Shorts, Historical, Shorts",3.5,2002.0
5047,Movie,Magic Bus,"Action, Sci Fi",3.5,1990.0
5049,Movie,Tezuka Productions,"Drama, Shounen, Doctors, Medical, Based on a Manga",3.5,1996.0
5051,TV   ,Nippon Animation,"Mystery, Sci Fi",3.5,2004.0
5052,Movie,SATELIGHT,"Mecha, Sci Fi",3.5,2007.0
5054,TV   ,BN Pictures,"Sci Fi, Shounen, Family Friendly, Proxy Battles",3.5,2020.0
5055,TV   ,Studio DEEN,"Action, Shounen, 17th Century, Body Sharing, Feudal Japan, Historical, Samurai, Supernatural, Based on a Manga",3.5,2002.0
5057,Movie,Pierrot,"Action, Shounen, Sports, Motorcycles, Racing, Based on a Manga",3.5,1987.0
5059,TV   ,Studio DEEN,"Seinen, Sports, Cars, Racing, Based on a Manga",3.5,1988.0
5060,Movie,Vasoon Animation,"Action, Adventure, Fantasy, Chinese Animation, Family Friendly",3.5,2013.0
5063,Movie,Shin-Ei Animation,"Adventure, Comedy, Sci Fi, Aliens, Crude",3.5,2017.0
5064,Movie,Toei Animation,"Japanese Mythology, Supernatural, Youkai",3.5,1986.0
5065,TV   ,BEE TRAIN,"Action, Adventure, Sci Fi, Family Friendly, Person in a Strange World, Based on a Novel",3.5,2006.0
5066,TV   ,Palm Studio,"Drama, Seinen, Alcohol, Bar, Cooking, Episodic, Food and Beverage, Iyashikei, Restaurants, Work Life, Based on a Manga",3.5,2006.0
5067,TV   ,MADHOUSE,"Action, Sci Fi, Slice of Life, Aliens, Psychic Powers, Superpowers, Original Work",3.5,2001.0
5071,TV   ,MADHOUSE,"Action, Adventure, Seinen, Ancient China, Historical, Political, Romance of the Three Kingdoms, War, Based on a Manga, Violence",3.5,2009.0
5072,TV   ,J.C.Staff,"Sci Fi, Slice of Life, Military, Post-apocalyptic, Power Suits, Original Work",3.5,2007.0
5076,TV   ,Pollyanna Graphics,"Comedy, Fantasy, Animal Protagonists, Non-Human Protagonists, Short Episodes, Flash Animation",3.5,2015.0
5085,TV   ,Tokyo Kids,"Shounen, Sports, Family Friendly, Golf, Based on a Manga",3.5,2004.0
5086,TV   ,Production I.G,"Action, Adventure, Fantasy, Based on a Video Game",3.5,2008.0
5088,TV   ,OLM,"Adventure, Fantasy, Elemental Powers, Episodic, Family Friendly, Monsters, Proxy Battles, Based on a Video Game",3.5,2002.0
5091,TV   ,Shin-Ei Animation,"Drama, Historical, Based on a Manga",3.5,1990.0
5092,Movie,MADHOUSE,"Drama, Original Work",3.5,2017.0
5097,TV   ,Studio DEEN,"Comedy, GL, Romance, Seinen, Shoujo-ai, Slice of Life, School Life, Based on a 4-Koma Manga, Based on a Manga",3.5,2014.0
5101,TV   ,Ashi Productions,"Adventure, Sci Fi, Dinosaurs, Person in a Strange World, Based on a Novel",3.5,1995.0
5105,Movie,Sunrise,"Action, Sci Fi, Based on a Light Novel",3.5,1987.0
5106,Movie,Toei Animation,"Drama, Forest, Based on a Fairy Tale",3.5,1980.0
5107,Movie,Toei Animation,"Comedy, Romance",3.5,1984.0
5108,TV   ,Toei Animation,"Action, Adventure, Fantasy, Shounen, Angels, Chibi, Demons, Non-Human Protagonists",3.5,1987.0
5110,TV   ,Nippon Animation,"Sports, Baseball, Tournaments",3.5,1978.0
5111,TV   ,Kachidoki Studio,"Comedy, Slice of Life, Cats, Based on a Manga, Flash Animation",3.5,2015.0
5113,Movie,TMS Entertainment,"Comedy, Based on a Video Game",3.5,1987.0
5122,TV   ,Toei Animation,"Deal with the Devil, Episodic, Family Friendly, Mysterious Shop, Short Episodes, Supernatural, Based on a Novel",3.5,2020.0
5123,TV   ,Toei Animation,"Action, Feudal Japan, Ninja, Superheroes, Based on a Manga",3.5,1987.0
5124,Movie,Asahi Production,"Adventure, Fantasy, Christmas, Magic, Original Work",3.5,2019.0
5126,Movie,TMS Entertainment,"Comedy, Sports, Baseball",3.5,1983.0
5128,Movie,Tele-Cartoon Japan,"Action, Adventure, Historical, Martial Arts, Ninja, Samurai, Based on a Manga",3.5,1971.0
5131,Movie,Yamamura Animation,"Fantasy, Monsters, Shorts",3.5,2016.0
5132,TV   ,Knack,"Romance, Shoujo, Slice of Life, America, Family Life, Based on a Manga",3.5,1986.0
5133,Movie,Production I.G,"Action, Aviation, Europe, Military, Based on a Novel",3.5,2008.0
5136,TV   ,Fall 2008,"Slice of Life, Animal Protagonists, Dogs, Family Friendly, Food Protagonists, Non-Human Protagonists, Short Episodes",3.5,2008.0
5137,TV   ,Toei Animation,"Action, Mecha, Sci Fi, Shounen, Monster-of-the-week, Super Robot, Based on a Manga",3.5,1972.0
5142,TV   ,Sunrise,Sci Fi,3.5,1984.0
5144,TV   ,MADHOUSE,"Comedy, Sci Fi, Episodic, Outer Space",3.5,2004.0
5147,Movie,Shin-Ei Animation,"Comedy, Shounen, Ninja, Based on a Manga",3.5,1983.0
5149,Movie,Sunrise,"Action, Drama, Mecha, Sci Fi, Military, Outer Space, War",3.5,2018.0
5152,Movie,OLM,"Adventure, Fantasy, Shounen, Shorts, CG Animation",3.5,2016.0
5154,Movie,Takahashi Studio,"Adventure, Comedy, Seinen, Family Friendly, Japanese Mythology, Youkai, Based on a Manga",3.5,1993.0
5161,Movie,TMS Entertainment,"Comedy, Romance, Slice of Life",3.5,1982.0
5162,TV   ,SATELIGHT,"Action, Mecha, Angels, Reincarnation, Original Work",3.5,2005.0
5163,TV   ,Sunrise,"Mecha, Sci Fi, Original Work",3.5,1998.0
5164,TV   ,Sunrise,"Mecha, Sci Fi, Real Robot, Original Work",3.5,1985.0
5165,TV   ,Pierrot,"Comedy, Crude, Gag, Based on a Manga",3.5,1999.0
5167,TV   ,Artland,"Comedy, Shounen, Crude, Episodic, Gag, Short Episodes, Based on a Manga",3.5,2008.0
5168,TV   ,Gallop,"Adventure, Fantasy, Animal Protagonists, Anthropomorphic, Original Work",3.5,1990.0
5172,Movie,Toei Animation,"Comedy, Buddhism, Historical, Religion, Shorts",3.5,1978.0
5174,Movie,Picona Creative Studio,"Fantasy, Anime Tamago, England, Europe, Shorts, CG Animation",3.5,2018.0
5175,TV   ,TYO Animations,"Comedy, Josei, Romance, Childhood Friends, Romantic Comedy, Short Episodes, Tsundere, Based on a Manga",3.5,2018.0
5176,Movie,MADHOUSE,Original Work,3.5,1995.0
5177,TV   ,TMS Entertainment,"Shoujo, School Life, Siblings, Based on a Novel",3.5,1991.0
5178,TV   ,XEBEC,"Action, Sci Fi, Proxy Battles",3.5,2005.0
5179,TV   ,TMS Entertainment,"Adventure, Fantasy, Based on a Card Game",3.5,2005.0
5183,Movie,Asahi Production,"Sports, Ocean",3.5,2020.0
5184,Movie,BN Pictures,"Idols, Music, Showbiz, Based on a Card Game",3.5,2015.0
5186,TV   ,Sunrise,"Mecha, Sci Fi, Combining Mecha, Super Robot",3.5,1991.0
5192,Movie,Shin-Ei Animation,"Adventure, Sci Fi, Shounen, Cats, Family Friendly, Magic, Non-Human Protagonists, Robots, Based on a Manga",3.5,1984.0
5194,TV   ,Pierrot,"Mecha, Sci Fi, Aliens, Original Work",3.5,1985.0
5195,Movie,Toei Animation,"Shounen, Sports, Soccer, Based on a Manga",3.5,1994.0
5196,Movie,Toei Animation,"Action, Adventure, Shounen, Hand to Hand Combat, Martial Arts, Superpowers, Based on a Manga",3.5,1986.0
5199,TV   ,M.S.C.,"Reverse Harem, Romance, Steampunk, Based on an Otome Game, Based on a Visual Novel",3.5,2017.0
5200,Movie,Sunrise,"Drama, Romance, Sci Fi, School Life, Time Travel, Based on a Novel",3.5,2012.0
5201,TV   ,Ashi Productions,"Fantasy, Magical Girl, Romance, Shoujo, Henshin Heroes, Magic, Based on a Manga",3.5,2003.0
5203,Movie,Shin-Ei Animation,"Sci Fi, Shounen, Cats, Family Friendly, Non-Human Protagonists, Robots, Time Travel, Based on a Manga",3.49,2000.0
5205,Movie,Shin-Ei Animation,"Comedy, Crude",3.49,1996.0
5207,Movie,Production I.G,"Action, Comedy, Abstract, Crude, Prison, Original Work, Mature Themes,, Nudity,, Physical Abuse,, Sexual Content,, Violence",3.49,2004.0
5210,TV   ,Sunrise,"Action, Mecha, Sci Fi, Combining Mecha, Super Robot, Trains, Original Work",3.49,1993.0
5211,TV   ,TMS Entertainment,"Action, Drama, Seinen, Assassins, Guns, Based on a Manga, Mature Themes,, Suicide",3.49,2005.0
5212,TV   ,MADHOUSE,"Comedy, Seinen, Slice of Life, Police, Based on a Manga, Mature Themes",3.49,2022.0
5213,TV   ,OLM,"Shounen, Sports, Soccer, Based on a Video Game",3.49,2018.0
5216,TV   ,Nippon Animation,"Comedy, Shoujo, Slice of Life, Family Friendly, School Life, Based on a Manga",3.49,1995.0
5217,TV   ,Kinema Citrus,"Action, Shounen, Supernatural, Superpowers, Based on a Manga, Animal Abuse,, Mature Themes",3.49,2012.0
5221,TV   ,ILCA,"Horror, Episodic, Short Episodes, Supernatural, Urban Legend, Original Work",3.49,2013.0
5223,Movie,Shin-Ei Animation,"Comedy, Crude, Feudal Japan, Samurai, Time Travel",3.49,1995.0
5224,TV   ,Sunrise,"Action, Mecha, Sci Fi, Monster-of-the-week, Super Robot",3.49,1978.0
5227,TV   ,Studio DEEN,"Action, Adventure, Comedy, Fantasy, Shounen, Swordplay, Based on a Manga",3.49,2001.0
5228,TV   ,Sunshine Corporation,"Comedy, Fantasy, Romance, Shoujo, Magic, Based on a Manga",3.49,2006.0
5229,Movie,J.C.Staff,"Drama, Slice of Life, Anime Tamago, Music, Shorts, Original Work",3.49,2015.0
5232,TV   ,Toei Animation,"Fantasy, Family Friendly, Magic, Short Episodes",3.49,1998.0
5233,TV   ,Sunrise,"Action, Adventure, Mecha, Sci Fi, Robots, Original Work",3.49,1989.0
5235,TV   ,Candy Box,"Comedy, Slice of Life, Anthropomorphic, Military, Military School, School Life, Short Episodes, Based on a 4-Koma Manga, Based on a Manga",3.49,2021.0
